filename,publication_date,download_time,primary_topic_id,primary_topic_name
W4387449490.pdf,2023-10-09,2025-08-14T04:03:10.164380,https://openalex.org/T10621,Gene Regulatory Network Analysis
W4387450512.pdf,2023-10-09,2025-08-14T04:03:10.991458,https://openalex.org/T12205,Time Series Analysis and Forecasting
W4387451022.pdf,2023-09-28,2025-08-14T04:03:11.890184,https://openalex.org/T10860,Speech and Audio Processing
W4387452813.pdf,2023-10-09,2025-08-14T04:03:12.447038,https://openalex.org/T12536,Topological and Geometric Data Analysis
W4387453993.pdf,2023-10-09,2025-08-14T04:03:13.307079,https://openalex.org/T11344,Traffic Prediction and Management Techniques
W4387454158.pdf,2023-10-09,2025-08-14T04:03:14.592328,https://openalex.org/T11645,Urban, Neighborhood, and Segregation Studies
W4387456814.pdf,2023-10-09,2025-08-14T04:03:19.790450,https://openalex.org/T10773,Extracellular vesicles in disease
W4387460941.pdf,2023-10-09,2025-08-14T04:03:23.114054,https://openalex.org/T10586,Robotic Path Planning Algorithms
W4387461442.pdf,2023-10-09,2025-08-14T04:04:28.970234,https://openalex.org/T10682,Quantum Computing Algorithms and Architecture
W4387461692.pdf,2023-10-07,2025-08-14T04:04:29.691427,https://openalex.org/T10270,Blockchain Technology Applications and Security
W4387473764.pdf,2023-10-10,2025-08-14T04:04:30.564257,https://openalex.org/T12482,Tunneling and Rock Mechanics
W4387477884.pdf,2023-09-13,2025-08-14T04:04:31.746597,https://openalex.org/T10482,Mathematical and Theoretical Epidemiology and Ecology Models
W4387481303.pdf,2023-10-10,2025-08-14T04:04:31.947006,https://openalex.org/T11489,Air Traffic Management and Optimization
W4387490268.pdf,2023-10-10,2025-08-14T04:04:32.412149,https://openalex.org/T12131,Wireless Signal Modulation Classification
W4387494073.pdf,2023-10-10,2025-08-14T04:04:33.471072,https://openalex.org/T11606,Infrastructure Maintenance and Monitoring
W4387500339.pdf,2023-10-10,2025-08-14T04:04:34.365506,https://openalex.org/T10429,EEG and Brain-Computer Interfaces
W4387500598.pdf,2023-10-10,2025-08-14T04:05:17.873179,https://openalex.org/T10659,Marine animal studies overview
W4387503284.pdf,2023-10-10,2025-08-14T04:05:18.597890,https://openalex.org/T10444,Context-Aware Activity Recognition Systems
W4387503338.pdf,2023-10-10,2025-08-14T04:05:19.449113,https://openalex.org/T10121,Building Energy and Comfort Optimization
W4387514146.pdf,2023-10-10,2025-08-14T04:06:12.366756,https://openalex.org/T10581,Neural dynamics and brain function
W4387518565.pdf,2023-10-11,2025-08-14T04:06:13.504908,https://openalex.org/T10616,Smart Agriculture and AI
W4387519544.pdf,2023-10-10,2025-08-14T04:06:15.437215,https://openalex.org/T11438,Retinal Imaging and Analysis
W4387520829.pdf,2023-10-11,2025-08-14T04:06:16.892140,https://openalex.org/T11324,Spectroscopy Techniques in Biomedical and Chemical Research
W4387521217.pdf,2023-10-11,2025-08-14T04:06:19.729202,https://openalex.org/T10916,Surgical Simulation and Training
W4387523184.pdf,2023-10-11,2025-08-14T04:06:24.095252,https://openalex.org/T10862,AI in cancer detection
W4387528124.pdf,2023-10-11,2025-08-14T04:06:24.397908,https://openalex.org/T11206,Model Reduction and Neural Networks
W4387529723.pdf,2023-10-11,2025-08-14T04:06:25.986083,https://openalex.org/T11234,Precipitation Measurement and Analysis
W4387530611.pdf,2023-10-11,2025-08-14T04:06:26.534762,https://openalex.org/T10400,Network Security and Intrusion Detection
W4387537058.pdf,2023-10-11,2025-08-14T04:06:28.203898,https://openalex.org/T10667,Emotion and Mood Recognition
W4387537065.pdf,2023-10-11,2025-08-14T04:06:31.887990,https://openalex.org/T11438,Retinal Imaging and Analysis
W4387539339.pdf,2023-10-11,2025-08-14T04:06:32.875142,https://openalex.org/T13305,Teacher Professional Development and Motivation
W4387541508.pdf,2023-10-11,2025-08-14T04:06:34.228607,https://openalex.org/T10653,Robot Manipulation and Learning
W4387546514.pdf,2023-01-01,2025-08-14T04:06:39.740100,https://openalex.org/T10775,Generative Adversarial Networks and Image Synthesis
W4387563067.pdf,2023-10-12,2025-08-14T04:06:44.271813,https://openalex.org/T10465,Neurobiology of Language and Bilingualism
W4387564020.pdf,2023-10-12,2025-08-14T04:06:45.173622,https://openalex.org/T10916,Surgical Simulation and Training
W4387568331.pdf,2023-10-12,2025-08-14T04:06:46.839397,https://openalex.org/T10188,Advanced machining processes and optimization
W4387570928.pdf,2023-10-12,2025-08-14T04:06:47.741359,https://openalex.org/T10784,Muscle activation and electromyography studies
W4387572905.pdf,2023-10-01,2025-08-14T04:06:48.645159,https://openalex.org/T10251,Solar and Space Plasma Dynamics
W4387573316.pdf,2023-10-12,2025-08-14T04:06:49.428676,https://openalex.org/T11512,Anomaly Detection Techniques and Applications
W4387573480.pdf,2023-10-12,2025-08-14T04:06:51.055347,https://openalex.org/T13429,Electricity Theft Detection Techniques
W4387576716.pdf,2023-10-11,2025-08-14T04:06:51.949760,https://openalex.org/T12169,Non-Destructive Testing Techniques
W4387578240.pdf,2023-10-01,2025-08-14T04:06:53.328405,https://openalex.org/T12277,Frequency Control in Power Systems
W4387580934.pdf,2023-10-12,2025-08-14T04:06:54.096769,https://openalex.org/T10640,Spectroscopy and Chemometric Analyses
W4387581828.pdf,2023-10-12,2025-08-14T04:06:54.874777,https://openalex.org/T10745,Heart Rate Variability and Autonomic Control
W4387587127.pdf,2023-01-01,2025-08-14T04:06:56.043865,https://openalex.org/T14147,Innovative Approaches in Technology and Social Development
W4387587611.pdf,2023-01-01,2025-08-14T04:07:11.599154,https://openalex.org/T10860,Speech and Audio Processing
W4387587668.pdf,2023-10-12,2025-08-14T04:07:11.891423,https://openalex.org/T11458,Advanced Wireless Communication Technologies
W4387587675.pdf,2023-01-01,2025-08-14T04:07:14.743132,https://openalex.org/T10050,Multi-Criteria Decision Making
W4387587838.pdf,2023-10-12,2025-08-14T04:07:34.165427,https://openalex.org/T10764,Privacy-Preserving Technologies in Data
W4387602316.pdf,2023-10-13,2025-08-14T04:07:38.027961,https://openalex.org/T10300,Congenital Heart Disease Studies
W4387604320.pdf,2023-10-12,2025-08-14T04:07:38.399805,https://openalex.org/T13310,Subtitles and Audiovisual Media
W4387609213.pdf,2023-01-01,2025-08-14T04:07:43.757794,https://openalex.org/T10429,EEG and Brain-Computer Interfaces
W4387613014.pdf,2023-10-13,2025-08-14T04:07:44.849712,https://openalex.org/T11211,3D Surveying and Cultural Heritage
W4387614015.pdf,2023-10-13,2025-08-14T04:07:45.829950,https://openalex.org/T10586,Robotic Path Planning Algorithms
W4387614119.pdf,2023-10-13,2025-08-14T04:07:46.526611,https://openalex.org/T11324,Spectroscopy Techniques in Biomedical and Chemical Research
W4387614452.pdf,2023-10-13,2025-08-14T04:07:47.154821,https://openalex.org/T10763,Digital Transformation in Industry
W4387617159.pdf,2023-10-13,2025-08-14T04:07:48.064096,https://openalex.org/T10188,Advanced machining processes and optimization
W4387617386.pdf,2023-10-13,2025-08-14T04:07:49.071212,https://openalex.org/T11206,Model Reduction and Neural Networks
W4387617580.pdf,2023-10-13,2025-08-14T04:07:49.944591,https://openalex.org/T10928,Probabilistic and Robust Engineering Design
W4387617955.pdf,2023-10-13,2025-08-14T04:07:50.439133,https://openalex.org/T10883,Ethics and Social Impacts of AI
W4387618803.pdf,2023-10-13,2025-08-14T04:07:51.373219,https://openalex.org/T11059,Market Dynamics and Volatility
W4387620276.pdf,2023-09-01,2025-08-14T04:07:52.237244,https://openalex.org/T11612,Stochastic Gradient Optimization Techniques
W4387623874.pdf,2023-10-13,2025-08-14T04:07:55.000718,https://openalex.org/T10879,Robotic Locomotion and Control
W4387623893.pdf,2023-10-13,2025-08-14T04:07:55.719858,https://openalex.org/T11099,Autonomous Vehicle Technology and Safety
W4387623925.pdf,2023-01-01,2025-08-14T04:07:57.677980,https://openalex.org/T11099,Autonomous Vehicle Technology and Safety
W4387623972.pdf,2023-10-13,2025-08-14T04:08:01.499492,https://openalex.org/T11019,Image Enhancement Techniques
W4387629059.pdf,2023-10-13,2025-08-14T04:08:02.710913,https://openalex.org/T10883,Ethics and Social Impacts of AI
W4387629941.pdf,2023-10-13,2025-08-14T04:08:04.218358,https://openalex.org/T11942,Transportation and Mobility Innovations
W4387637828.pdf,2023-09-01,2025-08-14T04:08:09.494359,https://openalex.org/T10188,Advanced machining processes and optimization
W4387638134.pdf,2023-10-14,2025-08-14T04:08:10.220195,https://openalex.org/T10145,Consumer Behavior in Brand Consumption and Identification
W4387639021.pdf,2023-10-14,2025-08-14T04:08:10.643279,https://openalex.org/T10028,Topic Modeling
W4387642080.pdf,2023-10-13,2025-08-14T04:08:11.233356,https://openalex.org/T10664,Sentiment Analysis and Opinion Mining
W4387642891.pdf,2023-10-14,2025-08-14T04:08:11.839356,https://openalex.org/T11689,Adversarial Robustness in Machine Learning
W4387644050.pdf,2023-10-14,2025-08-14T04:08:12.221039,https://openalex.org/T10057,Face and Expression Recognition
W4387653251.pdf,2023-10-15,2025-08-14T04:08:12.690004,https://openalex.org/T12702,Brain Tumor Detection and Classification
W4387653872.pdf,2023-10-15,2025-08-14T04:08:13.237388,https://openalex.org/T10288,Fractional Differential Equations Solutions
W4387661133.pdf,2023-10-16,2025-08-14T04:08:16.452074,https://openalex.org/T11904,Spatial Cognition and Navigation
W4387663400.pdf,2023-09-01,2025-08-14T04:08:17.125421,https://openalex.org/T10834,Welding Techniques and Residual Stresses
W4387664377.pdf,2023-10-16,2025-08-14T04:08:18.000229,https://openalex.org/T10037,Physics of Superconductivity and Magnetism
W4387664418.pdf,2023-10-15,2025-08-14T04:08:28.248826,https://openalex.org/T11837,Iron and Steelmaking Processes
W4387665433.pdf,2023-10-16,2025-08-14T04:08:29.363936,https://openalex.org/T13602,Educational Methods and Media Use
W4387668374.pdf,2023-10-16,2025-08-14T04:08:30.903685,https://openalex.org/T10468,Photovoltaic System Optimization Techniques
W4387668969.pdf,2023-10-16,2025-08-14T04:08:31.918553,https://openalex.org/T10159,Ionosphere and magnetosphere dynamics
W4387670741.pdf,2023-10-15,2025-08-14T04:08:33.697945,https://openalex.org/T12026,Explainable Artificial Intelligence (XAI)
W4387671602.pdf,2023-10-16,2025-08-14T04:08:34.936824,https://openalex.org/T10616,Smart Agriculture and AI
W4387673095.pdf,2023-10-16,2025-08-14T04:08:36.490921,https://openalex.org/T10707,Cellular and Composite Structures
W4387673599.pdf,2023-10-16,2025-08-14T04:08:38.121321,https://openalex.org/T11398,Hand Gesture Recognition Systems
W4387673786.pdf,2023-10-16,2025-08-14T04:08:38.547067,https://openalex.org/T10260,Software Engineering Research
W4387675739.pdf,2023-10-16,2025-08-14T04:08:39.723653,https://openalex.org/T11398,Hand Gesture Recognition Systems
W4387676189.pdf,2023-10-16,2025-08-14T04:08:42.167624,https://openalex.org/T10190,Air Quality and Health Impacts
W4387681983.pdf,2023-01-01,2025-08-14T04:08:45.602566,https://openalex.org/T10682,Quantum Computing Algorithms and Architecture
W4387694381.pdf,2023-10-17,2025-08-14T04:08:46.451590,https://openalex.org/T10862,AI in cancer detection
W4387695002.pdf,2023-10-17,2025-08-14T04:08:47.630018,https://openalex.org/T10892,Drilling and Well Engineering
W4387695363.pdf,2023-10-17,2025-08-14T04:08:48.596895,https://openalex.org/T13553,Age of Information Optimization
W4387697880.pdf,2023-10-17,2025-08-14T04:08:50.663446,https://openalex.org/T11019,Image Enhancement Techniques
W4387704964.pdf,2023-10-17,2025-08-14T04:08:52.450829,https://openalex.org/T12157,Geochemistry and Geologic Mapping
W4387705798.pdf,2023-10-17,2025-08-14T04:08:52.763626,https://openalex.org/T10400,Network Security and Intrusion Detection
W4387709379.pdf,2023-10-17,2025-08-14T04:08:57.243978,https://openalex.org/T10824,Image Retrieval and Classification Techniques
W4387717464.pdf,2023-10-17,2025-08-14T04:08:59.380955,https://openalex.org/T10273,IoT and Edge/Fog Computing
W4387718460.pdf,2023-10-17,2025-08-14T04:09:00.143866,https://openalex.org/T11948,Machine Learning in Materials Science
W4387723209.pdf,2023-10-17,2025-08-14T04:09:01.172671,https://openalex.org/T10161,Rock Mechanics and Modeling
W4387730041.pdf,2023-10-17,2025-08-14T04:09:02.871550,https://openalex.org/T10026,Galaxies: Formation, Evolution, Phenomena
W4387731173.pdf,2023-10-18,2025-08-14T04:09:04.169960,https://openalex.org/T10640,Spectroscopy and Chemometric Analyses
W4387731476.pdf,2023-10-18,2025-08-14T04:09:06.413050,https://openalex.org/T10680,Wind Energy Research and Development
W4387737885.pdf,2023-10-18,2025-08-14T04:09:07.106913,https://openalex.org/T10121,Building Energy and Comfort Optimization
W4387740624.pdf,2023-10-18,2025-08-14T04:09:09.673684,https://openalex.org/T10970,Team Dynamics and Performance
W4387740876.pdf,2023-10-18,2025-08-14T04:09:12.345882,https://openalex.org/T10454,Optimal Power Flow Distribution
W4387743536.pdf,2023-10-18,2025-08-14T04:09:13.228204,https://openalex.org/T12131,Wireless Signal Modulation Classification
W4387754830.pdf,2023-05-22,2025-08-14T04:09:19.031375,https://openalex.org/T11326,Stock Market Forecasting Methods
W4387757672.pdf,2023-01-01,2025-08-14T04:09:21.846640,https://openalex.org/T10667,Emotion and Mood Recognition
W4387757688.pdf,2023-01-01,2025-08-14T04:09:23.255461,https://openalex.org/T11636,Artificial Intelligence in Healthcare and Education
W4387774107.pdf,2023-10-19,2025-08-14T04:09:25.598982,https://openalex.org/T11622,Maritime Navigation and Safety
W4387775258.pdf,2023-10-19,2025-08-14T04:09:26.615681,https://openalex.org/T13568,Wood and Agarwood Research
W4387775692.pdf,2023-09-01,2025-08-14T04:09:27.144585,https://openalex.org/T10081,Auditing, Earnings Management, Governance
W4387775840.pdf,2023-10-19,2025-08-14T04:09:27.760575,https://openalex.org/T13287,Robotic Process Automation Applications
W4387777071.pdf,2023-10-19,2025-08-14T04:09:29.151199,https://openalex.org/T12647,Traditional Chinese Medicine Studies
W4387777161.pdf,2023-01-10,2025-08-14T04:09:31.678093,https://openalex.org/T11891,Big Data and Business Intelligence
W4387780458.pdf,2023-10-19,2025-08-14T04:09:33.500477,https://openalex.org/T10429,EEG and Brain-Computer Interfaces
W4387784582.pdf,2023-10-01,2025-08-14T04:09:34.603232,https://openalex.org/T10170,Retinal Diseases and Treatments
W4387803216.pdf,2023-10-01,2025-08-14T04:09:36.280938,https://openalex.org/T13650,Computational Physics and Python Applications
W4387805775.pdf,2023-10-20,2025-08-14T04:09:45.221356,https://openalex.org/T10936,Millimeter-Wave Propagation and Modeling
W4387806222.pdf,2023-10-20,2025-08-14T04:09:45.917970,https://openalex.org/T10410,COVID-19 epidemiological studies
W4387809607.pdf,2023-10-20,2025-08-14T04:09:46.938723,https://openalex.org/T10640,Spectroscopy and Chemometric Analyses
W4387810115.pdf,2023-10-20,2025-08-14T04:09:48.298945,https://openalex.org/T12111,Industrial Vision Systems and Defect Detection
W4387816778.pdf,2023-10-20,2025-08-14T04:09:51.574361,https://openalex.org/T10050,Multi-Criteria Decision Making
W4387818026.pdf,2023-10-20,2025-08-14T04:09:52.091142,https://openalex.org/T10876,Fault Detection and Control Systems
W4387820169.pdf,2023-10-20,2025-08-14T04:09:52.983196,https://openalex.org/T10249,Distributed Control Multi-Agent Systems
W4387823237.pdf,2023-10-20,2025-08-14T04:09:54.257681,https://openalex.org/T12611,Neural Networks and Reservoir Computing
W4387835476.pdf,2023-10-20,2025-08-14T04:09:56.716251,https://openalex.org/T10235,Health disparities and outcomes
W4387845174.pdf,2023-10-21,2025-08-14T04:09:57.421524,https://openalex.org/T11400,Motivation and Self-Concept in Sports
W4387853540.pdf,2023-10-21,2025-08-14T04:09:58.921713,https://openalex.org/T11206,Model Reduction and Neural Networks
W4387859873.pdf,2023-10-22,2025-08-14T04:09:59.953158,https://openalex.org/T10396,Fatigue and fracture mechanics
W4387865439.pdf,2023-10-23,2025-08-14T04:10:00.579305,https://openalex.org/T12611,Neural Networks and Reservoir Computing
W4387869882.pdf,2023-05-28,2025-08-14T04:10:00.901434,https://openalex.org/T10764,Privacy-Preserving Technologies in Data
W4387870541.pdf,2023-09-11,2025-08-14T04:10:01.312933,https://openalex.org/T11038,Advanced SAR Imaging Techniques
W4387870579.pdf,2023-05-28,2025-08-14T04:10:02.684050,https://openalex.org/T13553,Age of Information Optimization
W4387872097.pdf,2023-10-23,2025-08-14T04:10:08.152088,https://openalex.org/T10931,Direction-of-Arrival Estimation Techniques
W4387876389.pdf,2023-10-23,2025-08-14T04:10:09.601663,https://openalex.org/T10111,Remote Sensing in Agriculture
W4387876716.pdf,2023-10-23,2025-08-14T04:10:10.801983,https://openalex.org/T10009,Dementia and Cognitive Impairment Research
W4387885648.pdf,2023-10-23,2025-08-14T04:10:18.215738,https://openalex.org/T11019,Image Enhancement Techniques
W4387885854.pdf,2023-10-23,2025-08-14T04:10:20.376701,https://openalex.org/T10727,Ultrasound Imaging and Elastography
W4387886031.pdf,2023-01-01,2025-08-14T04:10:22.720790,https://openalex.org/T10400,Network Security and Intrusion Detection
W4387889509.pdf,2023-10-23,2025-08-14T04:10:24.638403,https://openalex.org/T11478,Caching and Content Delivery
W4387893406.pdf,2023-10-24,2025-08-14T04:10:25.957185,https://openalex.org/T10218,Sepsis Diagnosis and Treatment
W4387895007.pdf,2023-10-23,2025-08-14T04:10:28.225650,https://openalex.org/T10757,Geographic Information Systems Studies
W4387902682.pdf,2023-10-24,2025-08-14T04:10:29.276465,https://openalex.org/T10220,Machine Fault Diagnosis Techniques
W4387904404.pdf,2023-10-24,2025-08-14T04:10:29.932401,https://openalex.org/T10050,Multi-Criteria Decision Making
W4387906854.pdf,2023-10-24,2025-08-14T04:10:31.105681,https://openalex.org/T12640,Environmental DNA in Biodiversity Studies
W4387907597.pdf,2023-10-24,2025-08-14T04:10:32.201937,https://openalex.org/T12432,Arctic and Russian Policy Studies
W4387909360.pdf,2023-10-24,2025-08-14T04:10:32.845297,https://openalex.org/T10400,Network Security and Intrusion Detection
W4387917771.pdf,2023-10-24,2025-08-14T04:10:33.161435,https://openalex.org/T10524,Traffic control and management
W4387918034.pdf,2023-10-24,2025-08-14T04:10:33.639194,https://openalex.org/T11185,Integrated Energy Systems Optimization
W4387931634.pdf,2023-10-25,2025-08-14T04:10:35.927170,https://openalex.org/T11636,Artificial Intelligence in Healthcare and Education
W4387934861.pdf,2023-10-25,2025-08-14T04:10:37.465888,https://openalex.org/T11122,Online Learning and Analytics
W4387939529.pdf,2023-10-25,2025-08-14T04:10:39.365187,https://openalex.org/T11042,Corruption and Economic Development
W4387945883.pdf,2023-10-25,2025-08-14T04:10:40.277387,https://openalex.org/T12503,Social Acceptance of Renewable Energy
W4387951990.pdf,2023-01-01,2025-08-14T04:12:06.771258,https://openalex.org/T10036,Advanced Neural Network Applications
W4387954559.pdf,2023-10-26,2025-08-14T04:12:07.666445,https://openalex.org/T11252,Evolutionary Game Theory and Cooperation
W4387954881.pdf,2023-10-26,2025-08-14T04:12:10.710308,https://openalex.org/T11685,Zebrafish Biomedical Research Applications
W4387956915.pdf,2023-10-26,2025-08-14T04:12:12.945849,https://openalex.org/T12154,Pelvic and Acetabular Injuries
W4387965286.pdf,2023-10-27,2025-08-14T04:12:14.986227,https://openalex.org/T10922,Magnetic Properties and Synthesis of Ferrites
W4387965978.pdf,2023-10-26,2025-08-14T04:12:15.795390,https://openalex.org/T10862,AI in cancer detection
W4387967646.pdf,2023-10-27,2025-08-14T04:12:18.415877,https://openalex.org/T10653,Robot Manipulation and Learning
W4387967900.pdf,2023-10-26,2025-08-14T04:12:19.435338,https://openalex.org/T11105,Advanced Image Processing Techniques
W4387968013.pdf,2023-10-26,2025-08-14T04:12:26.167180,https://openalex.org/T11659,Advanced Image Fusion Techniques
W4387968015.pdf,2023-10-26,2025-08-14T04:12:31.252417,https://openalex.org/T12325,Urban Design and Spatial Analysis
W4387968150.pdf,2023-10-26,2025-08-14T04:12:32.892225,https://openalex.org/T11689,Adversarial Robustness in Machine Learning
W4387968164.pdf,2023-10-26,2025-08-14T04:12:34.088171,https://openalex.org/T10201,Speech Recognition and Synthesis
W4387968290.pdf,2023-10-26,2025-08-14T04:12:35.271449,https://openalex.org/T11273,Advanced Graph Neural Networks
W4387968387.pdf,2023-10-26,2025-08-14T04:12:35.773258,https://openalex.org/T11605,Visual Attention and Saliency Detection
W4387968707.pdf,2023-10-26,2025-08-14T04:12:39.207849,https://openalex.org/T10824,Image Retrieval and Classification Techniques
W4387969028.pdf,2023-10-26,2025-08-14T04:12:39.891038,https://openalex.org/T11273,Advanced Graph Neural Networks
W4387969474.pdf,2023-10-27,2025-08-14T04:12:40.919113,https://openalex.org/T10015,Genomics and Phylogenetic Studies
W4387969566.pdf,2023-10-26,2025-08-14T04:12:41.471618,https://openalex.org/T11019,Image Enhancement Techniques
W4387969660.pdf,2023-10-26,2025-08-14T04:12:41.945808,https://openalex.org/T11273,Advanced Graph Neural Networks
W4387971125.pdf,2023-10-27,2025-08-14T04:12:42.795671,https://openalex.org/T10616,Smart Agriculture and AI
W4387974474.pdf,2023-10-26,2025-08-14T04:12:43.906800,https://openalex.org/T10223,Microgrid Control and Optimization
W4387974652.pdf,2023-10-27,2025-08-14T04:12:45.465434,https://openalex.org/T14400,Medical Coding and Health Information
W4387976309.pdf,2023-10-27,2025-08-14T04:12:46.748468,https://openalex.org/T10400,Network Security and Intrusion Detection
W4387986386.pdf,2023-01-01,2025-08-14T04:12:47.409812,https://openalex.org/T11206,Model Reduction and Neural Networks
W4388007495.pdf,2023-10-27,2025-08-14T04:12:53.207635,https://openalex.org/T11801,Reservoir Engineering and Simulation Methods
W4388009117.pdf,2023-10-29,2025-08-14T04:12:55.140604,https://openalex.org/T11170,Biomimetic flight and propulsion mechanisms
W4388017727.pdf,2023-10-29,2025-08-14T04:12:56.104919,https://openalex.org/T10586,Robotic Path Planning Algorithms
W4388018725.pdf,2023-10-30,2025-08-14T04:12:57.272697,https://openalex.org/T11671,Fuzzy and Soft Set Theory
W4388018876.pdf,2023-01-01,2025-08-14T04:13:01.554530,https://openalex.org/T10689,Remote-Sensing Image Classification
W4388019172.pdf,2023-10-30,2025-08-14T04:13:17.273903,https://openalex.org/T11186,Hydrology and Drought Analysis
W4388020714.pdf,2023-10-27,2025-08-14T04:13:19.464109,https://openalex.org/T10036,Advanced Neural Network Applications
W4388021737.pdf,2023-09-14,2025-08-14T04:13:20.235777,https://openalex.org/T11516,Visual and Cognitive Learning Processes
W4388022176.pdf,2023-10-30,2025-08-14T04:13:25.832692,https://openalex.org/T10400,Network Security and Intrusion Detection
W4388023231.pdf,2023-10-30,2025-08-14T04:13:26.770371,https://openalex.org/T10330,Hydrology and Watershed Management Studies
W4388031349.pdf,2023-10-30,2025-08-14T04:13:27.993457,https://openalex.org/T11804,Quantum many-body systems
W4388033440.pdf,2023-10-01,2025-08-14T04:13:28.480074,https://openalex.org/T10071,Bone health and osteoporosis research
W4388038431.pdf,2023-10-31,2025-08-14T04:14:25.657911,https://openalex.org/T11373,Sleep and Work-Related Fatigue
W4388041247.pdf,2023-10-31,2025-08-14T04:14:26.073705,https://openalex.org/T11822,Analytic and geometric function theory
W4388043491.pdf,2023-10-31,2025-08-14T04:14:32.772309,https://openalex.org/T10664,Sentiment Analysis and Opinion Mining
W4388052743.pdf,2023-01-01,2025-08-14T04:14:37.741932,https://openalex.org/T12277,Frequency Control in Power Systems
W4388052856.pdf,2023-10-31,2025-08-14T04:14:41.351265,https://openalex.org/T10388,Advanced Steganography and Watermarking Techniques
W4388074634.pdf,2023-10-31,2025-08-14T04:14:42.530895,https://openalex.org/T11211,3D Surveying and Cultural Heritage
W4388096790.pdf,2023-01-01,2025-08-14T04:15:06.665391,https://openalex.org/T10863,Voice and Speech Disorders
W4388097017.pdf,2023-10-30,2025-08-14T04:15:09.245704,https://openalex.org/T10682,Quantum Computing Algorithms and Architecture
W4388101642.pdf,2023-10-30,2025-08-14T04:15:09.938724,https://openalex.org/T11438,Retinal Imaging and Analysis
W4388109643.pdf,2023-10-30,2025-08-14T04:15:11.893353,https://openalex.org/T13030,Survey Sampling and Estimation Techniques
W4388110901.pdf,2023-01-01,2025-08-14T04:15:14.442561,https://openalex.org/T13832,Advanced Decision-Making Techniques
W4388110913.pdf,2023-01-01,2025-08-14T04:15:16.495081,https://openalex.org/T10616,Smart Agriculture and AI
W4388110964.pdf,2023-01-01,2025-08-14T04:15:18.711112,https://openalex.org/T12707,Vehicle License Plate Recognition
W4388115169.pdf,2023-11-01,2025-08-14T04:15:20.615440,https://openalex.org/T11062,Gear and Bearing Dynamics Analysis
W4388117480.pdf,2023-09-04,2025-08-14T04:15:22.034116,https://openalex.org/T10392,Cutaneous Melanoma Detection and Management
W4388120002.pdf,2023-11-01,2025-08-14T04:15:22.391332,https://openalex.org/T10220,Machine Fault Diagnosis Techniques
W4388125269.pdf,2023-11-01,2025-08-14T04:15:24.232455,https://openalex.org/T10919,Neurological disorders and treatments
W4388140995.pdf,2023-11-01,2025-08-14T04:15:28.581855,https://openalex.org/T10211,Computational Drug Discovery Methods
W4388141441.pdf,2023-11-01,2025-08-14T04:15:29.263047,https://openalex.org/T11438,Retinal Imaging and Analysis
W4388144315.pdf,2023-01-01,2025-08-14T04:15:30.241665,https://openalex.org/T10228,Multilevel Inverters and Converters
W4388144571.pdf,2023-01-01,2025-08-14T04:15:31.175339,https://openalex.org/T12592,Opinion Dynamics and Social Influence
W4388145589.pdf,2023-01-01,2025-08-14T04:15:31.950686,https://openalex.org/T12026,Explainable Artificial Intelligence (XAI)
W4388182543.pdf,2023-10-28,2025-08-14T04:15:33.190964,https://openalex.org/T10688,Image and Signal Denoising Methods
W4388185268.pdf,2023-10-27,2025-08-14T04:15:35.103012,https://openalex.org/T11636,Artificial Intelligence in Healthcare and Education
W4388185880.pdf,2023-10-26,2025-08-14T04:15:35.526422,https://openalex.org/T11273,Advanced Graph Neural Networks
