filename,publication_date,download_time,primary_topic_id,primary_topic_name
W4390907087.pdf,2024-01-01,2025-08-13T21:47:01.768919,https://openalex.org/T10883,Ethics and Social Impacts of AI
W4392545143.pdf,2024-03-07,2025-08-13T21:52:33.766161,https://openalex.org/T12384,Customer churn and segmentation
W4390913216.pdf,2024-01-16,2025-08-13T21:52:56.752576,https://openalex.org/T10758,Cinema and Media Studies
W4392404413.pdf,2024-01-01,2025-08-13T21:53:38.885265,https://openalex.org/T11344,Traffic Prediction and Management Techniques
W4390500345.pdf,2024-01-02,2025-08-13T21:53:52.797191,https://openalex.org/T11918,Forecasting Techniques and Applications
W4393222196.pdf,2024-03-27,2025-08-13T21:54:15.304733,https://openalex.org/T12026,Explainable Artificial Intelligence (XAI)
W4391515593.pdf,2024-01-30,2025-08-13T21:54:29.140361,https://openalex.org/T12394,Insurance and Financial Risk Management
W4392550838.pdf,2024-03-07,2025-08-13T21:54:31.410764,https://openalex.org/T10644,Cryospheric studies and observations
W4391448220.pdf,2024-01-28,2025-08-13T21:54:51.444315,https://openalex.org/T10862,AI in cancer detection
W4393239942.pdf,2024-01-01,2025-08-13T21:55:39.905527,https://openalex.org/T10482,Mathematical and Theoretical Epidemiology and Ecology Models
W4386065249.pdf,2023-08-01,2025-08-13T22:04:42.714312,https://openalex.org/T11326,Stock Market Forecasting Methods
W4317039742.pdf,2023-01-17,2025-08-13T22:07:17.254533,https://openalex.org/T11396,Artificial Intelligence in Healthcare
W4324117906.pdf,2023-01-01,2025-08-13T22:08:28.338166,https://openalex.org/T11864,Supply Chain Resilience and Risk Management
W4383820970.pdf,2023-07-10,2025-08-13T22:10:08.071211,https://openalex.org/T10439,Climate change impacts on agriculture
W4322631423.pdf,2023-04-28,2025-08-13T22:13:47.509299,https://openalex.org/T10026,Galaxies: Formation, Evolution, Phenomena
W4318311500.pdf,2023-01-27,2025-08-13T22:16:09.364754,https://openalex.org/T10466,Meteorological Phenomena and Simulations
W4376868034.pdf,2023-05-17,2025-08-13T22:17:03.876643,https://openalex.org/T13018,Seismology and Earthquake Studies
W4384500389.pdf,2023-07-17,2025-08-13T22:17:28.199535,https://openalex.org/T10095,Cosmology and Gravitation Theories
W4380995173.pdf,2023-06-02,2025-08-13T22:18:52.809358,https://openalex.org/T10058,Entrepreneurship Studies and Influences
W4313893684.pdf,2023-01-09,2025-08-13T22:19:58.587037,https://openalex.org/T12157,Geochemistry and Geologic Mapping
W4390509480.pdf,2024-01-02,2025-08-13T22:25:02.778249,https://openalex.org/T11241,Advanced Malware Detection Techniques
W4391776064.pdf,2024-02-13,2025-08-13T22:25:56.064939,https://openalex.org/T11652,Imbalanced Data Classification Techniques
W4390838178.pdf,2024-01-07,2025-08-13T22:27:07.280676,https://openalex.org/T11326,Stock Market Forecasting Methods
W4393504808.pdf,2024-04-02,2025-08-13T22:31:08.695178,https://openalex.org/T11326,Stock Market Forecasting Methods
W4394584235.pdf,2024-01-01,2025-08-13T22:31:10.292819,https://openalex.org/T10482,Mathematical and Theoretical Epidemiology and Ecology Models
W4390858856.pdf,2024-01-14,2025-08-13T22:35:42.949176,https://openalex.org/T14260,Impact of AI and Big Data on Business and Society
W4391753670.pdf,2024-02-12,2025-08-13T22:36:03.470926,https://openalex.org/T11371,Wind and Air Flow Studies
W4409262853.pdf,2025-02-26,2025-08-13T22:38:11.193405,https://openalex.org/T11438,Retinal Imaging and Analysis
W4407200339.pdf,2025-02-06,2025-08-13T22:38:48.734824,https://openalex.org/T11052,Energy Load and Power Forecasting
W4319983346.pdf,2023-02-10,2025-08-13T22:45:34.770150,https://openalex.org/T10550,Ovarian cancer diagnosis and treatment
W4383164198.pdf,2023-07-05,2025-08-13T22:49:57.567339,https://openalex.org/T11182,Auction Theory and Applications
W4386995182.pdf,2023-09-24,2025-08-13T22:54:34.652712,https://openalex.org/T10228,Multilevel Inverters and Converters
W4363610659.pdf,2023-01-01,2025-08-13T22:56:29.679110,https://openalex.org/T10355,Impact of Technology on Adolescents
W4313598059.pdf,2023-01-04,2025-08-13T22:58:46.266361,https://openalex.org/T12206,Vibration and Dynamic Analysis
W4390508614.pdf,2024-01-02,2025-08-13T23:04:19.418103,https://openalex.org/T14484,Technology and Data Analysis
W4394716505.pdf,2024-04-11,2025-08-13T23:07:23.253546,https://openalex.org/T14139,E-commerce and Technology Innovations
W4390750338.pdf,2024-01-01,2025-08-13T23:08:58.676105,https://openalex.org/T13913,Blockchain Technology in Education and Learning
W4391997673.pdf,2024-01-01,2025-08-13T23:10:06.393055,https://openalex.org/T10541,Nonlinear Differential Equations Analysis
W4392438470.pdf,2024-03-01,2025-08-13T23:10:27.074673,https://openalex.org/T12126,Maritime Transport Emissions and Efficiency
W4392546875.pdf,2024-03-07,2025-08-13T23:10:44.877931,https://openalex.org/T11918,Forecasting Techniques and Applications
W4392918407.pdf,2024-03-18,2025-08-13T23:11:09.127686,https://openalex.org/T11653,Financial Distress and Bankruptcy Prediction
W4393066138.pdf,2024-01-01,2025-08-13T23:11:27.155110,https://openalex.org/T11652,Imbalanced Data Classification Techniques
W4394725743.pdf,2024-04-11,2025-08-13T23:11:50.783176,https://openalex.org/T12384,Customer churn and segmentation
W4391052954.pdf,2024-01-20,2025-08-13T23:15:05.018070,https://openalex.org/T11995,FinTech, Crowdfunding, Digital Finance
W4391582688.pdf,2024-01-01,2025-08-13T23:15:42.471075,https://openalex.org/T11667,Advanced Chemical Sensor Technologies
W4391644038.pdf,2024-02-08,2025-08-13T23:16:12.585535,https://openalex.org/T11918,Forecasting Techniques and Applications
W4392034510.pdf,2024-02-22,2025-08-13T23:16:34.200535,https://openalex.org/T10667,Emotion and Mood Recognition
W4392549813.pdf,2024-03-07,2025-08-13T23:16:51.295425,https://openalex.org/T10338,Advanced Sensor and Energy Harvesting Materials
W4400416862.pdf,2024-07-08,2025-08-13T23:19:04.659489,https://openalex.org/T12611,Neural Networks and Reservoir Computing
W4401211009.pdf,2024-08-01,2025-08-13T23:19:17.173676,https://openalex.org/T10425,Cold Atom Physics and Bose-Einstein Condensates
W4401852607.pdf,2024-08-24,2025-08-13T23:19:20.220451,https://openalex.org/T10664,Sentiment Analysis and Opinion Mining
W4408164588.pdf,2025-03-05,2025-08-13T23:19:43.385263,https://openalex.org/T11891,Big Data and Business Intelligence
W4408472572.pdf,2025-03-14,2025-08-13T23:19:44.543817,https://openalex.org/T10282,Financial Risk and Volatility Modeling
W4315434850.pdf,2023-01-11,2025-08-13T23:19:56.392945,https://openalex.org/T12443,Delphi Technique in Research
W4315486926.pdf,2023-01-10,2025-08-13T23:19:59.157767,https://openalex.org/T10238,Spine and Intervertebral Disc Pathology
W4385440660.pdf,2023-07-20,2025-08-13T23:23:30.795172,https://openalex.org/T10105,Osteoarthritis Treatment and Mechanisms
W4320017429.pdf,2023-02-10,2025-08-13T23:25:04.344331,https://openalex.org/T10397,Nutrition and Health in Aging
W4322580758.pdf,2023-02-27,2025-08-13T23:25:20.937578,https://openalex.org/T10157,Sports Performance and Training
W4379143350.pdf,2023-06-02,2025-08-13T23:27:05.998186,https://openalex.org/T13377,Ecosystem dynamics and resilience
W4382243449.pdf,2023-06-27,2025-08-13T23:27:26.765184,https://openalex.org/T10157,Sports Performance and Training
W4382698802.pdf,2023-06-30,2025-08-13T23:27:43.509242,https://openalex.org/T13674,Computer Science and Engineering
W4386841789.pdf,2023-09-01,2025-08-13T23:29:04.043727,https://openalex.org/T13002,Southeast Asian Sociopolitical Studies
W4316341607.pdf,2023-01-01,2025-08-13T23:30:26.851569,https://openalex.org/T10727,Ultrasound Imaging and Elastography
W4317493196.pdf,2023-01-20,2025-08-13T23:30:29.939165,https://openalex.org/T14462,Educational Methods and Impacts
W4327727018.pdf,2023-03-17,2025-08-13T23:31:58.492248,https://openalex.org/T10468,Photovoltaic System Optimization Techniques
W4361858356.pdf,2023-03-31,2025-08-13T23:32:20.307326,https://openalex.org/T10105,Osteoarthritis Treatment and Mechanisms
W4366077018.pdf,2023-04-17,2025-08-13T23:32:32.677153,https://openalex.org/T11035,Salivary Gland Tumors Diagnosis and Treatment
W4377971371.pdf,2023-05-24,2025-08-13T23:34:17.325007,https://openalex.org/T11636,Artificial Intelligence in Healthcare and Education
W4382137418.pdf,2023-06-23,2025-08-13T23:34:50.290815,https://openalex.org/T10026,Galaxies: Formation, Evolution, Phenomena
W4387394008.pdf,2023-10-07,2025-08-13T23:36:16.455290,https://openalex.org/T10916,Surgical Simulation and Training
W4388517902.pdf,2023-11-09,2025-08-13T23:36:29.176893,https://openalex.org/T10521,RNA and protein synthesis mechanisms
W4311837967.pdf,2023-02-22,2025-08-13T23:36:55.384115,https://openalex.org/T11486,Micro and Nano Robotics
W4315619584.pdf,2023-01-11,2025-08-13T23:37:08.748723,https://openalex.org/T11892,Kawasaki Disease and Coronary Complications
W4362500831.pdf,2023-04-03,2025-08-13T23:40:12.703591,https://openalex.org/T11165,Image and Video Quality Assessment
W4366316549.pdf,2023-01-01,2025-08-13T23:40:57.845791,https://openalex.org/T10482,Mathematical and Theoretical Epidemiology and Ecology Models
W4379056907.pdf,2023-06-01,2025-08-13T23:41:50.876331,https://openalex.org/T14510,Medical Imaging and Analysis
W4388153243.pdf,2023-11-01,2025-08-13T23:47:34.356228,https://openalex.org/T11438,Retinal Imaging and Analysis
W4388539483.pdf,2023-11-09,2025-08-13T23:47:40.543640,https://openalex.org/T12026,Explainable Artificial Intelligence (XAI)
W4390704937.pdf,2024-01-10,2025-08-13T23:49:03.780840,https://openalex.org/T10029,Climate variability and models
W4390740753.pdf,2024-01-11,2025-08-13T23:49:05.820451,https://openalex.org/T10571,Robotic Mechanisms and Dynamics
W4391253529.pdf,2024-01-26,2025-08-13T23:50:41.750620,https://openalex.org/T10558,Advancements in Semiconductor Devices and Circuit Design
W4391528531.pdf,2024-02-01,2025-08-13T23:50:54.739020,https://openalex.org/T10836,Metabolomics and Mass Spectrometry Studies
W4391953361.pdf,2024-01-01,2025-08-13T23:51:33.467090,https://openalex.org/T10111,Remote Sensing in Agriculture
W4392004891.pdf,2024-02-21,2025-08-13T23:51:36.979817,https://openalex.org/T13280,Biomedical and Engineering Education
W4392502280.pdf,2024-03-06,2025-08-13T23:52:10.974322,https://openalex.org/T12153,Advanced Optical Sensing Technologies
W4392649320.pdf,2024-03-11,2025-08-13T23:52:16.492121,https://openalex.org/T10883,Ethics and Social Impacts of AI
W4393082638.pdf,2024-01-01,2025-08-13T23:52:41.464893,,
W4394597980.pdf,2024-01-03,2025-08-13T23:53:27.900538,https://openalex.org/T10689,Remote-Sensing Image Classification
W4394726710.pdf,2024-04-11,2025-08-13T23:53:32.645901,https://openalex.org/T11099,Autonomous Vehicle Technology and Safety
W4394728564.pdf,2024-04-11,2025-08-13T23:53:34.644850,https://openalex.org/T10452,Iron Metabolism and Disorders
W4394871020.pdf,2024-04-17,2025-08-13T23:53:41.919374,https://openalex.org/T12485,Optimism, Hope, and Well-being
W4396986117.pdf,2024-04-01,2025-08-13T23:54:21.684466,https://openalex.org/T13018,Seismology and Earthquake Studies
W4397293947.pdf,2024-05-20,2025-08-13T23:54:27.093734,https://openalex.org/T11542,Behavioral Health and Interventions
W4399175946.pdf,2024-05-30,2025-08-13T23:54:46.935564,https://openalex.org/T11519,Digital Mental Health Interventions
W4399427820.pdf,2024-06-07,2025-08-13T23:54:56.644192,https://openalex.org/T11737,Advanced Materials and Mechanics
W4399460014.pdf,2024-06-08,2025-08-13T23:54:57.611706,https://openalex.org/T11636,Artificial Intelligence in Healthcare and Education
W4399692341.pdf,2024-06-01,2025-08-13T23:55:05.361429,https://openalex.org/T11531,Healthcare Systems and Reforms
W4401394673.pdf,2024-08-07,2025-08-13T23:55:39.144052,https://openalex.org/T13702,Machine Learning in Healthcare
W4402097291.pdf,2024-08-30,2025-08-13T23:55:43.573853,https://openalex.org/T10400,Network Security and Intrusion Detection
W4402112142.pdf,2024-09-01,2025-08-13T23:55:43.813637,https://openalex.org/T10863,Voice and Speech Disorders
W4404650473.pdf,2024-11-13,2025-08-13T23:55:51.565006,https://openalex.org/T11479,Smart Cities and Technologies
W4387420330.pdf,2024-03-11,2025-08-13T23:55:56.911688,https://openalex.org/T10044,Protein Structure and Dynamics
W4390306248.pdf,2024-01-03,2025-08-13T23:56:01.361203,https://openalex.org/T10320,Neural Networks and Applications
W4390722651.pdf,2024-01-08,2025-08-13T23:56:26.009174,https://openalex.org/T10054,Parallel Computing and Optimization Techniques
W4390790424.pdf,2024-01-01,2025-08-13T23:56:40.333732,https://openalex.org/T11148,Language, Metaphor, and Cognition
W4391175776.pdf,2024-01-24,2025-08-13T23:57:06.080767,https://openalex.org/T13471,Cognitive Functions and Memory
W4391428431.pdf,2024-02-01,2025-08-13T23:57:21.627490,https://openalex.org/T11871,Advanced Statistical Methods and Models
W4391481062.pdf,2024-02-02,2025-08-13T23:57:28.186629,https://openalex.org/T10355,Impact of Technology on Adolescents
W4391671866.pdf,2024-02-02,2025-08-13T23:57:49.211851,https://openalex.org/T11891,Big Data and Business Intelligence
W4392102133.pdf,2024-02-23,2025-08-13T23:58:24.971734,https://openalex.org/T10280,Shoulder Injury and Treatment
W4392266853.pdf,2024-02-28,2025-08-13T23:58:40.063100,https://openalex.org/T10462,Reinforcement Learning in Robotics
W4392592031.pdf,2024-01-01,2025-08-14T00:00:02.618125,https://openalex.org/T12702,Brain Tumor Detection and Classification
W4392601267.pdf,2024-03-08,2025-08-14T00:00:03.347081,https://openalex.org/T12026,Explainable Artificial Intelligence (XAI)
W4392607789.pdf,2024-11-01,2025-08-14T00:00:06.546691,https://openalex.org/T10586,Robotic Path Planning Algorithms
W4392897255.pdf,2024-02-18,2025-08-14T00:00:18.845981,https://openalex.org/T10270,Blockchain Technology Applications and Security
W4393074572.pdf,2024-03-22,2025-08-14T00:00:24.739534,https://openalex.org/T13717,Advanced Algorithms and Applications
W4393094637.pdf,2024-03-22,2025-08-14T00:00:28.014750,https://openalex.org/T12761,Data Stream Mining Techniques
W4393157669.pdf,2024-03-25,2025-08-14T00:00:32.718588,https://openalex.org/T10322,Respiratory Support and Mechanisms
W4393182126.pdf,2024-03-26,2025-08-14T00:00:33.649700,https://openalex.org/T12422,Radiomics and Machine Learning in Medical Imaging
W4393192581.pdf,2024-03-26,2025-08-14T00:00:35.761550,https://openalex.org/T10202,Lung Cancer Diagnosis and Treatment
W4393405338.pdf,2024-04-02,2025-08-14T00:00:52.881995,https://openalex.org/T10338,Advanced Sensor and Energy Harvesting Materials
W4393417404.pdf,2024-04-02,2025-08-14T00:00:56.123397,https://openalex.org/T11490,Hydrological Forecasting Using AI
W4393440167.pdf,2024-04-02,2025-08-14T00:00:59.649679,https://openalex.org/T11159,Manufacturing Process and Optimization
W4394625873.pdf,2024-01-03,2025-08-14T00:01:19.077074,https://openalex.org/T11448,Face recognition and analysis
W4394698804.pdf,2024-01-01,2025-08-14T00:01:28.573722,https://openalex.org/T10036,Advanced Neural Network Applications
W4394714420.pdf,2024-04-11,2025-08-14T00:01:30.363629,https://openalex.org/T10763,Digital Transformation in Industry
W4400061061.pdf,2024-06-26,2025-08-14T00:03:35.472901,https://openalex.org/T10788,Neuroscience and Music Perception
W4401394702.pdf,2024-08-07,2025-08-14T00:04:01.944444,https://openalex.org/T11122,Online Learning and Analytics
W4401414422.pdf,2024-05-13,2025-08-14T00:04:04.616870,https://openalex.org/T10028,Topic Modeling
W4401415691.pdf,2024-05-13,2025-08-14T00:04:06.123300,https://openalex.org/T10586,Robotic Path Planning Algorithms
W4401416961.pdf,2024-05-13,2025-08-14T00:04:07.123416,https://openalex.org/T10653,Robot Manipulation and Learning
W4401417236.pdf,2024-05-13,2025-08-14T00:04:08.043239,https://openalex.org/T11714,Multimodal Machine Learning Applications
W4401418407.pdf,2024-08-08,2025-08-14T00:04:09.844091,https://openalex.org/T10808,Electric and Hybrid Vehicle Technologies
W4401459484.pdf,2024-08-01,2025-08-14T00:04:14.865826,https://openalex.org/T10330,Hydrology and Watershed Management Studies
W4401857110.pdf,2024-08-24,2025-08-14T00:04:18.941752,https://openalex.org/T10203,Recommender Systems and Techniques
W4401981478.pdf,2024-08-20,2025-08-14T00:04:26.551483,https://openalex.org/T10320,Neural Networks and Applications
W4403217314.pdf,2024-10-08,2025-08-14T00:04:31.406615,https://openalex.org/T11261,Quantum chaos and dynamical systems
W4322762262.pdf,2025-07-25,2025-08-14T00:04:41.761801,https://openalex.org/T11829,Mathematical Biology Tumor Growth
W4395463412.pdf,2025-08-06,2025-08-14T00:04:42.463397,https://openalex.org/T11110,Stability and Controllability of Differential Equations
W4402816246.pdf,2025-08-05,2025-08-14T00:04:50.611513,https://openalex.org/T10581,Neural dynamics and brain function
W4405956479.pdf,2025-08-01,2025-08-14T00:04:59.335635,https://openalex.org/T10571,Robotic Mechanisms and Dynamics
W4406033239.pdf,2025-07-22,2025-08-14T00:05:08.860241,https://openalex.org/T10621,Gene Regulatory Network Analysis
W4406878698.pdf,2025-01-23,2025-08-14T00:07:20.044845,https://openalex.org/T11590,Primary Care and Health Outcomes
W4406959035.pdf,2025-01-29,2025-08-14T00:07:25.947734,https://openalex.org/T11147,Misinformation and Its Impacts
W4408770960.pdf,2025-03-24,2025-08-14T00:09:37.461645,https://openalex.org/T11605,Visual Attention and Saliency Detection
W4409919933.pdf,2025-04-29,2025-08-14T00:12:01.477305,https://openalex.org/T11309,Music and Audio Processing
W4409963658.pdf,2025-04-30,2025-08-14T00:12:03.279812,https://openalex.org/T10203,Recommender Systems and Techniques
W4412363088.pdf,2025-07-12,2025-08-14T00:13:04.185895,https://openalex.org/T10211,Computational Drug Discovery Methods
W4412363687.pdf,2025-07-15,2025-08-14T00:13:09.574473,https://openalex.org/T10824,Image Retrieval and Classification Techniques
W4412521513.pdf,2025-07-18,2025-08-14T00:14:10.027192,https://openalex.org/T11948,Machine Learning in Materials Science
W4412589547.pdf,2025-07-23,2025-08-14T00:14:11.565727,https://openalex.org/T11948,Machine Learning in Materials Science
W4412762368.pdf,2025-07-30,2025-08-14T00:14:12.715486,https://openalex.org/T12026,Explainable Artificial Intelligence (XAI)
W4361215133.pdf,2023-03-27,2025-08-14T00:17:39.921067,https://openalex.org/T11652,Imbalanced Data Classification Techniques
W4367556371.pdf,2023-05-01,2025-08-14T00:18:32.262391,https://openalex.org/T11363,Dental Radiography and Imaging
W4384935444.pdf,2023-07-20,2025-08-14T00:20:26.642819,https://openalex.org/T11081,Advanced Control Systems Design
W4311000352.pdf,2023-02-15,2025-08-14T00:25:43.755288,https://openalex.org/T10026,Galaxies: Formation, Evolution, Phenomena
W4319079426.pdf,2023-02-03,2025-08-14T00:26:23.131608,https://openalex.org/T10466,Meteorological Phenomena and Simulations
W4319299129.pdf,2023-02-07,2025-08-14T00:26:28.885719,https://openalex.org/T12422,Radiomics and Machine Learning in Medical Imaging
W4321108640.pdf,2023-02-16,2025-08-14T00:27:02.647947,https://openalex.org/T14463,Diverse Scientific Research Studies
W4361275557.pdf,2023-03-30,2025-08-14T00:28:17.152470,https://openalex.org/T10603,Smart Grid Energy Management
W4377564372.pdf,2023-05-23,2025-08-14T00:29:43.259986,https://openalex.org/T10378,Advanced MRI Techniques and Applications
W4379467190.pdf,2023-01-01,2025-08-14T00:30:02.748590,https://openalex.org/T12127,Software System Performance and Reliability
W4382239917.pdf,2023-06-26,2025-08-14T00:30:51.805684,https://openalex.org/T11307,Domain Adaptation and Few-Shot Learning
W4383267364.pdf,2023-05-05,2025-08-14T00:31:20.222170,https://openalex.org/T12874,Digital Imaging for Blood Diseases
W4385412029.pdf,2023-07-01,2025-08-14T00:33:14.606500,https://openalex.org/T13851,Law, AI, and Intellectual Property
W4385998263.pdf,2023-08-19,2025-08-14T00:34:24.290480,https://openalex.org/T10064,Complex Network Analysis Techniques
W4386184988.pdf,2023-10-18,2025-08-14T00:34:38.891025,https://openalex.org/T10026,Galaxies: Formation, Evolution, Phenomena
W4386381524.pdf,2023-01-01,2025-08-14T00:34:45.905209,https://openalex.org/T12415,Employer Branding and e-HRM
W4387268142.pdf,2023-10-02,2025-08-14T00:35:03.943037,https://openalex.org/T11270,Complex Systems and Time Series Analysis
W4387651158.pdf,2023-10-15,2025-08-14T00:35:09.457666,https://openalex.org/T10759,Translation Studies and Practices
W4388183517.pdf,2023-01-01,2025-08-14T00:35:19.039667,https://openalex.org/T12262,Hate Speech and Cyberbullying Detection
W4313823263.pdf,2023-01-09,2025-08-14T00:36:18.362590,https://openalex.org/T10862,AI in cancer detection
W4320185801.pdf,2023-02-13,2025-08-14T00:38:19.774183,https://openalex.org/T10861,Ear Surgery and Otitis Media
W4320185942.pdf,2023-02-13,2025-08-14T00:38:22.057228,https://openalex.org/T10522,Medical Imaging Techniques and Applications
W4327651140.pdf,2023-03-16,2025-08-14T00:39:40.461598,https://openalex.org/T11653,Financial Distress and Bankruptcy Prediction
W4362505641.pdf,2023-03-31,2025-08-14T00:40:13.235323,https://openalex.org/T10581,Neural dynamics and brain function
W4366206473.pdf,2023-04-18,2025-08-14T00:40:57.029425,https://openalex.org/T10202,Lung Cancer Diagnosis and Treatment
W4366697773.pdf,2023-01-01,2025-08-14T00:41:05.100156,https://openalex.org/T10551,Scheduling and Optimization Algorithms
W4366742697.pdf,2023-04-21,2025-08-14T00:41:09.424784,https://openalex.org/T10086,Alzheimer's disease research and treatments
W4377247340.pdf,2023-04-01,2025-08-14T00:41:50.211486,https://openalex.org/T13038,Internet of Things and AI
W4377291886.pdf,2023-05-22,2025-08-14T00:41:57.351521,https://openalex.org/T10648,Virtual Reality Applications and Impacts
W4382240277.pdf,2023-06-26,2025-08-14T00:42:46.911233,https://openalex.org/T10036,Advanced Neural Network Applications
W4383376022.pdf,2023-07-05,2025-08-14T00:43:11.384188,https://openalex.org/T12486,Food Supply Chain Traceability
W4384130050.pdf,2023-07-13,2025-08-14T00:43:21.885853,https://openalex.org/T10456,Multi-Agent Systems and Negotiation
W4385237757.pdf,2023-07-25,2025-08-14T00:43:55.718448,https://openalex.org/T10648,Virtual Reality Applications and Impacts
W4385995010.pdf,2023-01-01,2025-08-14T00:45:38.116843,https://openalex.org/T11366,Elasticity and Material Modeling
W4386373092.pdf,2023-09-01,2025-08-14T00:45:52.582775,https://openalex.org/T10702,Insect and Arachnid Ecology and Behavior
W4387544822.pdf,2023-01-14,2025-08-14T00:46:30.173045,https://openalex.org/T13602,Educational Methods and Media Use
W4387657376.pdf,2023-10-15,2025-08-14T00:46:35.988498,https://openalex.org/T12920,Healthcare and Environmental Waste Management
W4388773228.pdf,2023-11-17,2025-08-14T00:47:37.421877,https://openalex.org/T10775,Generative Adversarial Networks and Image Synthesis
W4388823697.pdf,2023-11-20,2025-08-14T00:47:39.960929,https://openalex.org/T10838,Animal Behavior and Welfare Studies
W4388833075.pdf,2023-11-18,2025-08-14T00:47:41.488079,https://openalex.org/T10616,Smart Agriculture and AI
W4389058722.pdf,2023-11-27,2025-08-14T00:47:56.422469,https://openalex.org/T11438,Retinal Imaging and Analysis
W4390474297.pdf,2024-01-01,2025-08-14T00:50:38.022265,https://openalex.org/T10916,Surgical Simulation and Training
W4390474335.pdf,2024-01-01,2025-08-14T00:50:38.098960,https://openalex.org/T10916,Surgical Simulation and Training
W4390740124.pdf,2024-01-11,2025-08-14T00:51:14.009700,https://openalex.org/T10444,Context-Aware Activity Recognition Systems
W4390812911.pdf,2024-01-01,2025-08-14T00:51:24.140006,https://openalex.org/T11309,Music and Audio Processing
W4390961566.pdf,2024-01-17,2025-08-14T00:51:42.198367,https://openalex.org/T11394,Dynamics and Control of Mechanical Systems
W4391100346.pdf,2024-01-20,2025-08-14T00:51:57.121297,https://openalex.org/T12277,Frequency Control in Power Systems
W4391100352.pdf,2024-01-21,2025-08-14T00:51:57.985392,https://openalex.org/T11398,Hand Gesture Recognition Systems
W4391102446.pdf,2024-01-22,2025-08-14T00:52:00.123420,https://openalex.org/T12611,Neural Networks and Reservoir Computing
W4391102597.pdf,2024-01-21,2025-08-14T00:52:04.246211,https://openalex.org/T10689,Remote-Sensing Image Classification
W4391436098.pdf,2024-02-01,2025-08-14T00:52:34.104342,https://openalex.org/T11459,Arctic and Antarctic ice dynamics
W4391547833.pdf,2024-02-05,2025-08-14T00:52:45.268138,https://openalex.org/T10575,Wireless Communication Networks Research
W4391617314.pdf,2024-02-07,2025-08-14T00:52:53.631605,https://openalex.org/T10050,Multi-Criteria Decision Making
W4391678793.pdf,2024-02-01,2025-08-14T00:53:00.490929,https://openalex.org/T10325,Astro and Planetary Science
W4391783872.pdf,2024-02-12,2025-08-14T00:53:22.630278,https://openalex.org/T11941,Power System Reliability and Maintenance
W4391849633.pdf,2024-02-15,2025-08-14T00:53:37.073178,https://openalex.org/T12611,Neural Networks and Reservoir Computing
W4392101150.pdf,2024-02-23,2025-08-14T00:54:01.950774,https://openalex.org/T10140,Food composition and properties
W4392249698.pdf,2024-01-01,2025-08-14T00:54:23.262100,https://openalex.org/T10883,Ethics and Social Impacts of AI
W4392366895.pdf,2024-03-04,2025-08-14T00:54:28.356427,https://openalex.org/T10443,Social Policy and Reform Studies
W4392698425.pdf,2024-03-01,2025-08-14T00:55:06.563120,https://openalex.org/T10048,Particle physics theoretical and experimental studies
W4392702311.pdf,2024-01-31,2025-08-14T00:55:06.935464,https://openalex.org/T10057,Face and Expression Recognition
W4393056867.pdf,2024-03-21,2025-08-14T00:55:49.597823,https://openalex.org/T12611,Neural Networks and Reservoir Computing
W4393125904.pdf,2024-03-23,2025-08-14T00:55:58.525677,https://openalex.org/T10400,Network Security and Intrusion Detection
W4393160251.pdf,2024-03-24,2025-08-14T00:56:04.419931,https://openalex.org/T11550,Text and Document Classification Technologies
W4393252607.pdf,2024-01-01,2025-08-14T00:56:18.931644,https://openalex.org/T10273,IoT and Edge/Fog Computing
W4393871333.pdf,2024-01-01,2025-08-14T00:56:38.855943,https://openalex.org/T10545,Optimization and Variational Analysis
