filename,publication_date,download_time,primary_topic_id,primary_topic_name
W4361216888.pdf,2023-03-27,2025-08-14T06:16:16.032444,https://openalex.org/T11490,Hydrological Forecasting Using AI
W4361217380.pdf,2023-03-28,2025-08-14T06:16:16.830237,https://openalex.org/T13435,Animal and Plant Science Education
W4361218998.pdf,2023-03-28,2025-08-14T06:16:18.020412,https://openalex.org/T11133,UAV Applications and Optimization
W4361222322.pdf,2023-03-28,2025-08-14T06:16:19.464399,https://openalex.org/T10586,Robotic Path Planning Algorithms
W4361222645.pdf,2023-03-28,2025-08-14T06:16:20.455707,https://openalex.org/T10768,Electric Vehicles and Infrastructure
W4361222735.pdf,2023-03-01,2025-08-14T06:16:21.333430,https://openalex.org/T11044,Particle Detector Development and Performance
W4361223439.pdf,2023-03-01,2025-08-14T06:16:22.150519,https://openalex.org/T10039,Stellar, planetary, and galactic studies
W4361224206.pdf,2023-03-28,2025-08-14T06:16:22.631409,https://openalex.org/T11270,Complex Systems and Time Series Analysis
W4361225272.pdf,2023-03-27,2025-08-14T06:16:23.303478,https://openalex.org/T11252,Evolutionary Game Theory and Cooperation
W4361226109.pdf,2023-03-28,2025-08-14T06:16:24.432646,https://openalex.org/T11864,Supply Chain Resilience and Risk Management
W4361247654.pdf,2023-01-01,2025-08-14T06:16:27.830122,https://openalex.org/T10113,Dental materials and restorations
W4361249165.pdf,2023-03-30,2025-08-14T06:16:28.443963,https://openalex.org/T12443,Delphi Technique in Research
W4361264505.pdf,2023-03-30,2025-08-14T06:17:00.855571,https://openalex.org/T11483,Tropical and Extratropical Cyclones Research
W4361267246.pdf,2023-02-28,2025-08-14T06:17:06.645576,https://openalex.org/T12911,Water Resources and Sustainability
W4361267518.pdf,2023-03-29,2025-08-14T06:17:07.503495,https://openalex.org/T12045,Rice Cultivation and Yield Improvement
W4361267553.pdf,2023-03-30,2025-08-14T06:17:10.153835,https://openalex.org/T10510,Stroke Rehabilitation and Recovery
W4361270915.pdf,2023-03-30,2025-08-14T06:17:11.024676,https://openalex.org/T10084,Musculoskeletal pain and rehabilitation
W4361275181.pdf,2023-03-29,2025-08-14T06:17:15.044712,https://openalex.org/T10689,Remote-Sensing Image Classification
W4361275211.pdf,2023-03-29,2025-08-14T06:17:16.956446,https://openalex.org/T12388,Identification and Quantification in Food
W4361275494.pdf,2023-03-30,2025-08-14T06:17:18.085434,https://openalex.org/T10326,Indoor and Outdoor Localization Technologies
W4361275531.pdf,2023-03-29,2025-08-14T06:17:18.755488,https://openalex.org/T11692,Noise Effects and Management
W4361275708.pdf,2023-03-29,2025-08-14T06:17:20.424225,https://openalex.org/T10805,Vehicle Dynamics and Control Systems
W4361276347.pdf,2023-03-29,2025-08-14T06:17:22.079120,https://openalex.org/T10868,Soft Robotics and Applications
W4361277487.pdf,2023-03-29,2025-08-14T06:17:22.637713,https://openalex.org/T10400,Network Security and Intrusion Detection
W4361279728.pdf,2023-03-30,2025-08-14T06:17:23.962946,https://openalex.org/T11164,Remote Sensing and LiDAR Applications
W4361279928.pdf,2023-03-30,2025-08-14T06:17:25.349451,https://openalex.org/T11164,Remote Sensing and LiDAR Applications
W4361280362.pdf,2023-03-29,2025-08-14T06:17:26.433188,https://openalex.org/T10664,Sentiment Analysis and Opinion Mining
W4361281660.pdf,2023-03-30,2025-08-14T06:17:28.725858,https://openalex.org/T12290,Human Motion and Animation
W4361282549.pdf,2023-03-29,2025-08-14T06:17:29.917148,https://openalex.org/T10050,Multi-Criteria Decision Making
W4361283453.pdf,2023-03-28,2025-08-14T06:17:33.733490,https://openalex.org/T11448,Face recognition and analysis
W4361283568.pdf,2023-03-29,2025-08-14T06:17:36.167955,https://openalex.org/T10121,Building Energy and Comfort Optimization
W4361284555.pdf,2023-03-29,2025-08-14T06:17:36.939120,https://openalex.org/T10475,Psychological Well-being and Life Satisfaction
W4361284590.pdf,2023-03-01,2025-08-14T06:17:37.271264,https://openalex.org/T10026,Galaxies: Formation, Evolution, Phenomena
W4361285181.pdf,2023-03-29,2025-08-14T06:17:37.760294,https://openalex.org/T10546,Higher Education Governance and Development
W4361285401.pdf,2023-03-29,2025-08-14T06:17:39.083479,https://openalex.org/T11195,Simulation Techniques and Applications
W4361287508.pdf,2023-03-29,2025-08-14T06:17:51.090941,https://openalex.org/T10586,Robotic Path Planning Algorithms
W4361290830.pdf,2023-03-27,2025-08-14T06:17:52.720367,https://openalex.org/T10036,Advanced Neural Network Applications
W4361292007.pdf,2023-03-28,2025-08-14T06:17:55.106982,https://openalex.org/T10664,Sentiment Analysis and Opinion Mining
W4361292336.pdf,2023-03-29,2025-08-14T06:17:57.167625,https://openalex.org/T10672,Design Education and Practice
W4361295457.pdf,2023-03-29,2025-08-14T06:17:58.767108,https://openalex.org/T14147,Innovative Approaches in Technology and Social Development
W4361301790.pdf,2023-03-29,2025-08-14T06:17:59.362720,https://openalex.org/T10201,Speech Recognition and Synthesis
W4361303003.pdf,2023-03-29,2025-08-14T06:18:01.217704,https://openalex.org/T12542,Second Language Learning and Teaching
W4361303310.pdf,2023-03-29,2025-08-14T06:18:03.102321,https://openalex.org/T11138,Tribology and Lubrication Engineering
W4361304297.pdf,2023-03-29,2025-08-14T06:18:03.965278,https://openalex.org/T10331,Video Surveillance and Tracking Methods
W4361763555.pdf,2023-01-01,2025-08-14T06:18:05.132449,https://openalex.org/T10032,Marine and coastal ecosystems
W4361765365.pdf,2023-01-01,2025-08-14T06:18:12.656610,https://openalex.org/T11343,Power Transformer Diagnostics and Insulation
W4361801886.pdf,2023-01-01,2025-08-14T06:18:17.217792,https://openalex.org/T10663,Advanced Battery Technologies Research
W4361803701.pdf,2023-01-01,2025-08-14T06:18:17.528345,https://openalex.org/T10223,Microgrid Control and Optimization
W4361804460.pdf,2023-03-30,2025-08-14T06:18:19.314750,https://openalex.org/T10285,Venous Thromboembolism Diagnosis and Management
W4361804600.pdf,2023-04-26,2025-08-14T06:18:21.141308,https://openalex.org/T10203,Recommender Systems and Techniques
W4361806511.pdf,2023-11-10,2025-08-14T06:18:21.477605,https://openalex.org/T10378,Advanced MRI Techniques and Applications
W4361985144.pdf,2023-03-31,2025-08-14T06:18:26.887783,https://openalex.org/T10046,Stability and Control of Uncertain Systems
W4361985925.pdf,2023-01-01,2025-08-14T06:18:27.870007,https://openalex.org/T10574,Crime Patterns and Interventions
W4361986934.pdf,2023-01-01,2025-08-14T06:18:29.870008,https://openalex.org/T10338,Advanced Sensor and Energy Harvesting Materials
W4361987564.pdf,2023-01-01,2025-08-14T06:18:30.937558,https://openalex.org/T11309,Music and Audio Processing
W4361994798.pdf,2023-01-01,2025-08-14T06:18:33.038519,https://openalex.org/T13475,Digital Transformation in Law
W4362015666.pdf,2023-01-01,2025-08-14T06:18:34.214280,https://openalex.org/T11396,Artificial Intelligence in Healthcare
W4362450438.pdf,2023-03-29,2025-08-14T06:18:36.767607,https://openalex.org/T10429,EEG and Brain-Computer Interfaces
W4362453161.pdf,2023-04-01,2025-08-14T06:18:38.948183,https://openalex.org/T10206,Meta-analysis and systematic reviews
W4362454335.pdf,2023-03-30,2025-08-14T06:18:41.173583,https://openalex.org/T11110,Stability and Controllability of Differential Equations
W4362458233.pdf,2023-03-31,2025-08-14T06:18:41.532726,https://openalex.org/T10201,Speech Recognition and Synthesis
W4362459039.pdf,2023-03-31,2025-08-14T06:18:42.329219,https://openalex.org/T10928,Probabilistic and Robust Engineering Design
W4362465770.pdf,2023-03-31,2025-08-14T06:18:43.416795,https://openalex.org/T12101,Advanced Bandit Algorithms Research
W4362466603.pdf,2023-03-31,2025-08-14T06:18:51.073226,https://openalex.org/T10226,Land Use and Ecosystem Services
W4362466611.pdf,2023-03-30,2025-08-14T06:18:51.625231,https://openalex.org/T11692,Noise Effects and Management
W4362466612.pdf,2023-03-30,2025-08-14T06:18:52.842066,https://openalex.org/T12365,Effects of Environmental Stressors on Livestock
W4362467819.pdf,2023-03-30,2025-08-14T06:18:56.567994,https://openalex.org/T10616,Smart Agriculture and AI
W4362467866.pdf,2023-03-31,2025-08-14T06:18:57.571534,https://openalex.org/T11023,Prosthetics and Rehabilitation Robotics
W4362468504.pdf,2023-03-31,2025-08-14T06:18:58.476462,https://openalex.org/T10539,Sustainable Supply Chain Management
W4362471316.pdf,2023-03-31,2025-08-14T06:19:03.122190,https://openalex.org/T12072,Machine Learning and Algorithms
W4362471461.pdf,2023-03-31,2025-08-14T06:19:07.591333,https://openalex.org/T10627,Advanced Image and Video Retrieval Techniques
W4362471477.pdf,2023-03-31,2025-08-14T06:19:07.865765,https://openalex.org/T10928,Probabilistic and Robust Engineering Design
W4362471516.pdf,2023-03-31,2025-08-14T06:19:21.202275,https://openalex.org/T10719,3D Shape Modeling and Analysis
W4362473108.pdf,2023-03-31,2025-08-14T06:19:21.952085,https://openalex.org/T10216,Migration, Refugees, and Integration
W4362474006.pdf,2023-03-31,2025-08-14T06:19:22.430857,https://openalex.org/T11814,Advanced Manufacturing and Logistics Optimization
W4362475119.pdf,2023-03-25,2025-08-14T06:19:32.122380,https://openalex.org/T10333,Meat and Animal Product Quality
W4362506125.pdf,2023-04-02,2025-08-14T06:19:35.604836,https://openalex.org/T11374,Cleft Lip and Palate Research
W4362510872.pdf,2023-04-03,2025-08-14T06:19:35.863060,https://openalex.org/T11082,Spacecraft Dynamics and Control
W4362513466.pdf,2023-01-01,2025-08-14T06:19:36.902069,https://openalex.org/T12759,Vehicle Noise and Vibration Control
W4362513574.pdf,2023-04-03,2025-08-14T06:19:37.871312,https://openalex.org/T10211,Computational Drug Discovery Methods
W4362514210.pdf,2023-01-01,2025-08-14T06:19:43.887765,https://openalex.org/T11606,Infrastructure Maintenance and Monitoring
W4362519369.pdf,2023-03-18,2025-08-14T06:20:00.018795,https://openalex.org/T10664,Sentiment Analysis and Opinion Mining
W4362519416.pdf,2023-03-31,2025-08-14T06:20:21.235834,https://openalex.org/T10535,Landslides and related hazards
W4362524035.pdf,2023-04-04,2025-08-14T06:20:24.713016,https://openalex.org/T11826,Ocular Infections and Treatments
W4362527539.pdf,2023-03-31,2025-08-14T06:20:29.399928,https://openalex.org/T10616,Smart Agriculture and AI
W4362528929.pdf,2023-04-04,2025-08-14T06:20:31.133749,https://openalex.org/T10662,Ultrasonics and Acoustic Wave Propagation
W4362552804.pdf,2023-03-27,2025-08-14T06:20:32.605251,https://openalex.org/T11398,Hand Gesture Recognition Systems
W4362554958.pdf,2023-04-04,2025-08-14T06:20:34.110757,https://openalex.org/T10525,Human-Automation Interaction and Safety
W4362555408.pdf,2023-04-04,2025-08-14T06:20:35.596580,https://openalex.org/T11147,Misinformation and Its Impacts
W4362558276.pdf,2023-04-03,2025-08-14T06:20:36.764895,https://openalex.org/T10586,Robotic Path Planning Algorithms
W4362558332.pdf,2023-04-04,2025-08-14T06:20:39.527633,https://openalex.org/T10865,Shape Memory Alloy Transformations
W4362558476.pdf,2023-04-03,2025-08-14T06:20:41.607626,https://openalex.org/T10879,Robotic Locomotion and Control
W4362558675.pdf,2023-04-04,2025-08-14T06:20:44.248880,https://openalex.org/T11164,Remote Sensing and LiDAR Applications
W4362559025.pdf,2023-04-03,2025-08-14T06:20:46.019646,https://openalex.org/T10446,Income, Poverty, and Inequality
W4362559267.pdf,2023-04-03,2025-08-14T06:20:47.865279,https://openalex.org/T10440,Advanced Thermoelectric Materials and Devices
W4362559906.pdf,2023-04-03,2025-08-14T06:20:48.396834,https://openalex.org/T10621,Gene Regulatory Network Analysis
W4362560108.pdf,2023-04-03,2025-08-14T06:20:49.108873,https://openalex.org/T12093,Greenhouse Technology and Climate Control
W4362560538.pdf,2023-04-03,2025-08-14T06:20:50.187650,https://openalex.org/T10191,Robotics and Sensor-Based Localization
W4362560583.pdf,2023-04-04,2025-08-14T06:20:51.080543,https://openalex.org/T10134,Inflammatory Bowel Disease
W4362566373.pdf,2023-01-31,2025-08-14T06:20:52.142414,https://openalex.org/T10028,Topic Modeling
W4362567694.pdf,2023-04-04,2025-08-14T06:20:53.178273,https://openalex.org/T10640,Spectroscopy and Chemometric Analyses
W4362578077.pdf,2023-04-01,2025-08-14T06:20:57.588100,https://openalex.org/T10234,Obstructive Sleep Apnea Research
W4362582333.pdf,2023-04-03,2025-08-14T06:20:59.644515,https://openalex.org/T11667,Advanced Chemical Sensor Technologies
W4362582882.pdf,2023-04-01,2025-08-14T06:21:00.579105,https://openalex.org/T10388,Advanced Steganography and Watermarking Techniques
W4362585097.pdf,2023-04-03,2025-08-14T06:21:02.771921,https://openalex.org/T11052,Energy Load and Power Forecasting
W4362585994.pdf,2023-04-03,2025-08-14T06:21:03.688358,https://openalex.org/T10972,Power Systems Fault Detection
W4362586117.pdf,2023-04-02,2025-08-14T06:21:04.646044,https://openalex.org/T12190,Innovations in Concrete and Construction Materials
W4362586532.pdf,2023-03-31,2025-08-14T06:21:05.261588,https://openalex.org/T10745,Heart Rate Variability and Autonomic Control
W4362586725.pdf,2023-04-02,2025-08-14T06:21:06.040664,https://openalex.org/T10064,Complex Network Analysis Techniques
W4362586759.pdf,2023-04-01,2025-08-14T06:21:08.723722,https://openalex.org/T10586,Robotic Path Planning Algorithms
W4362588015.pdf,2023-04-02,2025-08-14T06:21:10.048572,https://openalex.org/T10331,Video Surveillance and Tracking Methods
W4362588849.pdf,2023-04-03,2025-08-14T06:21:10.380140,https://openalex.org/T10273,IoT and Edge/Fog Computing
W4362589384.pdf,2023-04-01,2025-08-14T06:21:10.584511,https://openalex.org/T11210,Mathematical Analysis and Transform Methods
W4362590575.pdf,2023-04-03,2025-08-14T06:21:11.244593,https://openalex.org/T10504,Sensorless Control of Electric Motors
W4362595284.pdf,2023-04-04,2025-08-14T06:21:13.391153,https://openalex.org/T10998,Heat Transfer and Optimization
W4362596316.pdf,2023-04-04,2025-08-14T06:21:16.313923,https://openalex.org/T10064,Complex Network Analysis Techniques
W4362600471.pdf,2023-03-31,2025-08-14T06:21:18.781982,https://openalex.org/T10664,Sentiment Analysis and Opinion Mining
W4362601503.pdf,2023-04-05,2025-08-14T06:21:21.986941,https://openalex.org/T11486,Micro and Nano Robotics
W4362601696.pdf,2023-04-05,2025-08-14T06:21:22.550094,https://openalex.org/T10634,Food Allergy and Anaphylaxis Research
W4362603363.pdf,2023-03-07,2025-08-14T06:21:23.386217,https://openalex.org/T10745,Heart Rate Variability and Autonomic Control
W4362607273.pdf,2023-04-01,2025-08-14T06:21:25.018502,https://openalex.org/T10466,Meteorological Phenomena and Simulations
W4362609145.pdf,2023-04-05,2025-08-14T06:21:28.685451,https://openalex.org/T11214,Human-Animal Interaction Studies
W4362609175.pdf,2023-04-01,2025-08-14T06:21:29.533689,https://openalex.org/T10818,Astrophysics and Cosmic Phenomena
W4362611739.pdf,2023-04-04,2025-08-14T06:21:31.056479,https://openalex.org/T11698,Underwater Acoustics Research
W4362614450.pdf,2023-04-04,2025-08-14T06:21:32.163906,https://openalex.org/T11139,Gout, Hyperuricemia, Uric Acid
W4362614690.pdf,2023-04-05,2025-08-14T06:21:32.660795,https://openalex.org/T10223,Microgrid Control and Optimization
W4362614804.pdf,2023-04-04,2025-08-14T06:21:33.569200,https://openalex.org/T10601,Handwritten Text Recognition Techniques
W4362616324.pdf,2023-04-04,2025-08-14T06:21:34.003193,https://openalex.org/T10058,Entrepreneurship Studies and Influences
W4362617742.pdf,2023-04-04,2025-08-14T06:21:35.163616,https://openalex.org/T11671,Fuzzy and Soft Set Theory
W4362624029.pdf,2023-04-05,2025-08-14T06:21:37.527479,https://openalex.org/T11479,Smart Cities and Technologies
W4362634998.pdf,2023-04-05,2025-08-14T06:21:41.083197,https://openalex.org/T11285,Hearing Impairment and Communication
W4362636383.pdf,2023-03-01,2025-08-14T06:21:42.853772,https://openalex.org/T11052,Energy Load and Power Forecasting
W4362647923.pdf,2023-04-05,2025-08-14T06:21:44.272898,https://openalex.org/T12488,Mental Health via Writing
W4362657610.pdf,2023-04-05,2025-08-14T06:21:51.116324,https://openalex.org/T10522,Medical Imaging Techniques and Applications
W4362660809.pdf,2023-04-06,2025-08-14T06:21:53.464362,https://openalex.org/T10326,Indoor and Outdoor Localization Technologies
W4362663300.pdf,2023-04-01,2025-08-14T06:21:55.198563,https://openalex.org/T10102,scientometrics and bibliometrics research
W4362664234.pdf,2023-04-06,2025-08-14T06:21:57.036669,https://openalex.org/T10682,Quantum Computing Algorithms and Architecture
W4362665030.pdf,2023-04-06,2025-08-14T06:21:58.572032,https://openalex.org/T11008,Aerodynamics and Acoustics in Jet Flows
W4362665550.pdf,2023-04-06,2025-08-14T06:21:59.478905,https://openalex.org/T10438,Energy, Environment, Economic Growth
W4362665561.pdf,2023-04-06,2025-08-14T06:22:00.149545,https://openalex.org/T10663,Advanced Battery Technologies Research
W4362665830.pdf,2023-04-06,2025-08-14T06:22:00.702108,https://openalex.org/T12357,Digital Media Forensic Detection
W4362666442.pdf,2023-04-06,2025-08-14T06:22:01.515955,https://openalex.org/T10028,Topic Modeling
W4362667533.pdf,2023-04-06,2025-08-14T06:22:02.074830,https://openalex.org/T12661,Iterative Methods for Nonlinear Equations
W4362668275.pdf,2023-04-06,2025-08-14T06:22:02.920916,https://openalex.org/T11512,Anomaly Detection Techniques and Applications
W4362669194.pdf,2023-04-06,2025-08-14T06:22:03.714349,https://openalex.org/T12105,Hygrothermal properties of building materials
W4362669226.pdf,2023-04-05,2025-08-14T06:22:06.324159,https://openalex.org/T11439,Video Analysis and Summarization
W4362669783.pdf,2023-04-05,2025-08-14T06:22:16.354300,https://openalex.org/T11344,Traffic Prediction and Management Techniques
W4362670000.pdf,2023-04-01,2025-08-14T06:22:17.880189,https://openalex.org/T10270,Blockchain Technology Applications and Security
W4362671785.pdf,2023-04-06,2025-08-14T06:22:20.125996,https://openalex.org/T10539,Sustainable Supply Chain Management
W4362671914.pdf,2023-04-05,2025-08-14T06:22:21.210048,https://openalex.org/T12111,Industrial Vision Systems and Defect Detection
W4362673256.pdf,2023-04-06,2025-08-14T06:22:21.944852,https://openalex.org/T11930,Cardiac, Anesthesia and Surgical Outcomes
W4362673521.pdf,2023-01-01,2025-08-14T06:22:23.158355,https://openalex.org/T10471,Climate Change Policy and Economics
W4362677912.pdf,2023-04-07,2025-08-14T06:22:25.860013,https://openalex.org/T12702,Brain Tumor Detection and Classification
W4362681517.pdf,2023-04-06,2025-08-14T06:22:26.235114,https://openalex.org/T10667,Emotion and Mood Recognition
W4362686431.pdf,2023-04-06,2025-08-14T06:22:37.742564,https://openalex.org/T11018,Lower Extremity Biomechanics and Pathologies
W4362690361.pdf,2023-04-06,2025-08-14T06:22:42.237748,https://openalex.org/T10036,Advanced Neural Network Applications
W4362695291.pdf,2023-04-07,2025-08-14T06:22:43.142754,https://openalex.org/T10211,Computational Drug Discovery Methods
W4362695293.pdf,2023-04-07,2025-08-14T06:22:44.501945,https://openalex.org/T10998,Heat Transfer and Optimization
W4362698936.pdf,2023-04-06,2025-08-14T06:22:45.461514,https://openalex.org/T10698,Transportation Planning and Optimization
W4362704509.pdf,2023-04-07,2025-08-14T06:22:52.505472,https://openalex.org/T10805,Vehicle Dynamics and Control Systems
W4362716325.pdf,2023-03-01,2025-08-14T06:22:55.367190,https://openalex.org/T13377,Ecosystem dynamics and resilience
W4362732309.pdf,2023-04-10,2025-08-14T06:22:56.304183,https://openalex.org/T11326,Stock Market Forecasting Methods
W4362733446.pdf,2023-04-07,2025-08-14T06:22:59.949233,https://openalex.org/T10601,Handwritten Text Recognition Techniques
W4362733479.pdf,2023-04-09,2025-08-14T06:23:01.477997,https://openalex.org/T11133,UAV Applications and Optimization
W4362735763.pdf,2023-04-10,2025-08-14T06:23:02.855557,https://openalex.org/T11775,COVID-19 diagnosis using AI
W4362735915.pdf,2023-04-10,2025-08-14T06:23:03.896496,https://openalex.org/T11304,Advanced Neuroimaging Techniques and Applications
W4363609855.pdf,2023-01-01,2025-08-14T06:23:08.086286,https://openalex.org/T12090,Language and cultural evolution
W4363645321.pdf,2023-04-10,2025-08-14T06:23:12.681499,https://openalex.org/T10207,Advanced biosensing and bioanalysis techniques
W4363648952.pdf,2023-03-22,2025-08-14T06:23:14.642972,https://openalex.org/T12131,Wireless Signal Modulation Classification
W4363650231.pdf,2023-04-10,2025-08-14T06:23:15.153018,https://openalex.org/T10727,Ultrasound Imaging and Elastography
W4363650897.pdf,2023-04-08,2025-08-14T06:23:15.543784,https://openalex.org/T13546,Census and Population Estimation
W4363674395.pdf,2023-04-10,2025-08-14T06:23:21.476306,https://openalex.org/T10586,Robotic Path Planning Algorithms
W4363674843.pdf,2023-04-07,2025-08-14T06:23:22.051753,https://openalex.org/T10688,Image and Signal Denoising Methods
W4363675738.pdf,2023-04-07,2025-08-14T06:23:23.410473,https://openalex.org/T12707,Vehicle License Plate Recognition
W4363676594.pdf,2023-04-10,2025-08-14T06:23:30.376438,https://openalex.org/T12772,Control and Stability of Dynamical Systems
W4363677645.pdf,2023-04-09,2025-08-14T06:23:30.947750,https://openalex.org/T11190,3D Printing in Biomedical Research
W4363678250.pdf,2023-04-10,2025-08-14T06:23:33.157453,https://openalex.org/T13602,Educational Methods and Media Use
W4363678301.pdf,2023-04-10,2025-08-14T06:23:41.112251,https://openalex.org/T12157,Geochemistry and Geologic Mapping
W4363678375.pdf,2023-04-10,2025-08-14T06:23:41.851308,https://openalex.org/T11988,Sustainable Building Design and Assessment
W4364352089.pdf,2023-04-11,2025-08-14T06:23:47.064422,https://openalex.org/T11659,Advanced Image Fusion Techniques
W4364361342.pdf,2023-04-11,2025-08-14T06:23:48.482361,https://openalex.org/T10655,GNSS positioning and interference
W4364365948.pdf,2023-04-11,2025-08-14T06:23:49.238837,https://openalex.org/T10582,Ethics in Clinical Research
W4364367808.pdf,2023-04-11,2025-08-14T06:23:50.130295,https://openalex.org/T10880,Environmental Sustainability in Business
W4364368408.pdf,2023-04-11,2025-08-14T06:23:50.990378,https://openalex.org/T10355,Impact of Technology on Adolescents
W4364375062.pdf,2023-04-11,2025-08-14T06:23:51.876059,https://openalex.org/T10358,Advanced Radiotherapy Techniques
W4364375774.pdf,2023-04-11,2025-08-14T06:23:52.930923,https://openalex.org/T11378,Gastrointestinal Bleeding Diagnosis and Treatment
W4364376524.pdf,2023-04-11,2025-08-14T06:23:55.143812,https://openalex.org/T10833,Vaccine Coverage and Hesitancy
W4364376634.pdf,2023-04-11,2025-08-14T06:23:57.368511,https://openalex.org/T10895,Species Distribution and Climate Change
W4364377439.pdf,2023-04-11,2025-08-14T06:23:57.973036,https://openalex.org/T10466,Meteorological Phenomena and Simulations
W4364378674.pdf,2023-04-10,2025-08-14T06:23:59.247024,https://openalex.org/T10177,Palliative Care and End-of-Life Issues
W4364378700.pdf,2023-04-11,2025-08-14T06:24:00.922164,https://openalex.org/T11775,COVID-19 diagnosis using AI
W4364379718.pdf,2023-04-11,2025-08-14T06:24:01.815974,https://openalex.org/T10463,Pulsars and Gravitational Waves Research
W4365130488.pdf,2023-04-11,2025-08-14T06:24:03.282503,https://openalex.org/T10191,Robotics and Sensor-Based Localization
W4365130574.pdf,2023-04-11,2025-08-14T06:24:04.555551,https://openalex.org/T10223,Microgrid Control and Optimization
W4365130951.pdf,2023-01-01,2025-08-14T06:24:05.466484,https://openalex.org/T11236,Control Systems and Identification
W4365135076.pdf,2023-04-12,2025-08-14T06:24:06.622853,https://openalex.org/T11187,Nonlinear Dynamics and Pattern Formation
W4365136071.pdf,2023-04-12,2025-08-14T06:24:07.203360,https://openalex.org/T10816,Cerebrovascular and Carotid Artery Diseases
W4365136871.pdf,2023-04-08,2025-08-14T06:24:09.797192,https://openalex.org/T14182,Technology-Enhanced Education Studies
W4365138156.pdf,2023-04-12,2025-08-14T06:24:12.303364,https://openalex.org/T10502,Advanced Memory and Neural Computing
W4365142070.pdf,2023-04-11,2025-08-14T06:24:13.229514,https://openalex.org/T10100,Metaheuristic Optimization Algorithms Research
W4365144707.pdf,2023-04-12,2025-08-14T06:24:14.250567,https://openalex.org/T13559,Edcuational Technology Systems
W4365145592.pdf,2023-04-12,2025-08-14T06:24:15.216894,https://openalex.org/T10020,Quantum Information and Cryptography
W4365146704.pdf,2023-04-11,2025-08-14T06:24:18.132529,https://openalex.org/T10627,Advanced Image and Video Retrieval Techniques
W4365147042.pdf,2023-04-11,2025-08-14T06:24:18.922198,https://openalex.org/T10805,Vehicle Dynamics and Control Systems
W4365147828.pdf,2023-04-11,2025-08-14T06:24:19.780139,https://openalex.org/T10662,Ultrasonics and Acoustic Wave Propagation
W4365148621.pdf,2023-04-12,2025-08-14T06:24:20.694238,https://openalex.org/T10531,Advanced Vision and Imaging
W4365148686.pdf,2023-04-11,2025-08-14T06:24:21.914036,https://openalex.org/T10111,Remote Sensing in Agriculture
W4365149662.pdf,2023-04-11,2025-08-14T06:24:22.804796,https://openalex.org/T12026,Explainable Artificial Intelligence (XAI)
W4365150495.pdf,2023-04-12,2025-08-14T06:24:23.982685,https://openalex.org/T11948,Machine Learning in Materials Science
W4365152787.pdf,2023-04-12,2025-08-14T06:24:25.928009,https://openalex.org/T10648,Virtual Reality Applications and Impacts
W4365420733.pdf,2023-04-12,2025-08-14T06:24:35.814485,https://openalex.org/T10191,Robotics and Sensor-Based Localization
W4365421034.pdf,2023-04-12,2025-08-14T06:24:36.665166,https://openalex.org/T10586,Robotic Path Planning Algorithms
W4365443103.pdf,2023-04-13,2025-08-14T06:24:40.365233,https://openalex.org/T11737,Advanced Materials and Mechanics
W4365443424.pdf,2023-04-13,2025-08-14T06:24:41.695490,https://openalex.org/T10805,Vehicle Dynamics and Control Systems
W4365448257.pdf,2023-04-08,2025-08-14T06:24:44.602380,https://openalex.org/T11689,Adversarial Robustness in Machine Learning
W4365449116.pdf,2023-04-13,2025-08-14T06:24:45.372601,https://openalex.org/T10191,Robotics and Sensor-Based Localization
W4365450718.pdf,2023-04-13,2025-08-14T06:24:46.439695,https://openalex.org/T11691,Forest Insect Ecology and Management
