filename,publication_date,download_time,primary_topic_id,primary_topic_name
W4401412212.pdf,2024-08-01,2025-08-14T05:23:25.963266,https://openalex.org/T10466,Meteorological Phenomena and Simulations
W4401413631.pdf,2024-05-13,2025-08-14T05:23:26.777493,https://openalex.org/T10772,Distributed systems and fault tolerance
W4401413650.pdf,2024-05-13,2025-08-14T05:23:28.070495,https://openalex.org/T10653,Robot Manipulation and Learning
W4401413773.pdf,2024-05-13,2025-08-14T05:23:28.507918,https://openalex.org/T12111,Industrial Vision Systems and Defect Detection
W4401413794.pdf,2024-05-13,2025-08-14T05:23:29.362523,https://openalex.org/T10531,Advanced Vision and Imaging
W4401413870.pdf,2024-01-01,2025-08-14T05:23:32.840017,https://openalex.org/T10378,Advanced MRI Techniques and Applications
W4401414024.pdf,2024-05-13,2025-08-14T05:23:36.791698,https://openalex.org/T10531,Advanced Vision and Imaging
W4401414033.pdf,2024-05-13,2025-08-14T05:23:37.756437,https://openalex.org/T11164,Remote Sensing and LiDAR Applications
W4401414212.pdf,2024-05-13,2025-08-14T05:23:40.289515,https://openalex.org/T10627,Advanced Image and Video Retrieval Techniques
W4401414237.pdf,2024-05-13,2025-08-14T05:23:40.669546,https://openalex.org/T10429,EEG and Brain-Computer Interfaces
W4401414391.pdf,2024-05-13,2025-08-14T05:23:42.792012,https://openalex.org/T10616,Smart Agriculture and AI
W4401414394.pdf,2024-05-13,2025-08-14T05:23:44.398374,https://openalex.org/T10906,AI-based Problem Solving and Planning
W4401414501.pdf,2024-08-08,2025-08-14T05:23:45.296733,https://openalex.org/T13052,Molecular Communication and Nanonetworks
W4401414541.pdf,2024-05-13,2025-08-14T05:23:46.433675,https://openalex.org/T10638,Optical measurement and interference techniques
W4401414761.pdf,2024-05-13,2025-08-14T05:23:48.063335,https://openalex.org/T11159,Manufacturing Process and Optimization
W4401414909.pdf,2024-05-13,2025-08-14T05:23:48.853109,https://openalex.org/T10191,Robotics and Sensor-Based Localization
W4401414913.pdf,2024-05-13,2025-08-14T05:23:49.177289,https://openalex.org/T10462,Reinforcement Learning in Robotics
W4401414990.pdf,2024-05-13,2025-08-14T05:23:49.441157,https://openalex.org/T10791,Advanced Control Systems Optimization
W4401415074.pdf,2024-01-01,2025-08-14T05:23:53.343202,https://openalex.org/T10040,Adaptive Control of Nonlinear Systems
W4401415103.pdf,2024-05-13,2025-08-14T05:23:54.639775,https://openalex.org/T10879,Robotic Locomotion and Control
W4401415110.pdf,2024-05-13,2025-08-14T05:23:57.547446,https://openalex.org/T11714,Multimodal Machine Learning Applications
W4401415335.pdf,2024-06-30,2025-08-14T05:23:57.887308,https://openalex.org/T12478,Wikis in Education and Collaboration
W4401415354.pdf,2024-05-13,2025-08-14T05:24:00.084394,https://openalex.org/T10914,Tactile and Sensory Interactions
W4401415480.pdf,2024-05-13,2025-08-14T05:24:01.116484,https://openalex.org/T10531,Advanced Vision and Imaging
W4401415530.pdf,2024-05-13,2025-08-14T05:24:01.494906,https://openalex.org/T11714,Multimodal Machine Learning Applications
W4401415579.pdf,2024-05-13,2025-08-14T05:24:04.998945,https://openalex.org/T12784,Modular Robots and Swarm Intelligence
W4401415682.pdf,2024-05-13,2025-08-14T05:24:05.366855,https://openalex.org/T10191,Robotics and Sensor-Based Localization
W4401415761.pdf,2024-05-13,2025-08-14T05:24:21.754428,https://openalex.org/T10653,Robot Manipulation and Learning
W4401415859.pdf,2024-05-13,2025-08-14T05:24:22.014482,https://openalex.org/T11099,Autonomous Vehicle Technology and Safety
W4401415925.pdf,2024-05-13,2025-08-14T05:24:22.746292,https://openalex.org/T10036,Advanced Neural Network Applications
W4401416044.pdf,2024-05-13,2025-08-14T05:24:23.305931,https://openalex.org/T10524,Traffic control and management
W4401416425.pdf,2024-05-13,2025-08-14T05:24:24.491517,https://openalex.org/T11099,Autonomous Vehicle Technology and Safety
W4401416464.pdf,2024-05-13,2025-08-14T05:24:26.094004,https://openalex.org/T10036,Advanced Neural Network Applications
W4401416480.pdf,2024-05-13,2025-08-14T05:24:26.799859,https://openalex.org/T10191,Robotics and Sensor-Based Localization
W4401416661.pdf,2024-05-13,2025-08-14T05:24:28.421154,https://openalex.org/T10531,Advanced Vision and Imaging
W4401416687.pdf,2024-05-13,2025-08-14T05:24:29.255942,https://openalex.org/T11622,Maritime Navigation and Safety
W4401416739.pdf,2024-05-13,2025-08-14T05:24:31.555457,https://openalex.org/T10879,Robotic Locomotion and Control
W4401416757.pdf,2024-05-13,2025-08-14T05:24:32.540111,https://openalex.org/T10876,Fault Detection and Control Systems
W4401416763.pdf,2024-05-13,2025-08-14T05:24:33.716259,https://openalex.org/T10627,Advanced Image and Video Retrieval Techniques
W4401416843.pdf,2024-05-13,2025-08-14T05:24:35.780693,https://openalex.org/T10653,Robot Manipulation and Learning
W4401416866.pdf,2024-05-13,2025-08-14T05:24:36.287784,https://openalex.org/T10036,Advanced Neural Network Applications
W4401417072.pdf,2024-05-13,2025-08-14T05:24:36.943018,https://openalex.org/T10191,Robotics and Sensor-Based Localization
W4401417181.pdf,2024-05-13,2025-08-14T05:24:40.282521,https://openalex.org/T10879,Robotic Locomotion and Control
W4401417197.pdf,2024-05-13,2025-08-14T05:24:41.005652,https://openalex.org/T11099,Autonomous Vehicle Technology and Safety
W4401417267.pdf,2024-05-13,2025-08-14T05:24:42.883039,https://openalex.org/T10191,Robotics and Sensor-Based Localization
W4401417288.pdf,2024-05-13,2025-08-14T05:24:43.621845,https://openalex.org/T10531,Advanced Vision and Imaging
W4401417383.pdf,2024-05-13,2025-08-14T05:24:44.146029,https://openalex.org/T11099,Autonomous Vehicle Technology and Safety
W4401417637.pdf,2024-01-01,2025-08-14T05:24:46.010262,https://openalex.org/T11396,Artificial Intelligence in Healthcare
W4401420787.pdf,2024-08-08,2025-08-14T05:24:48.156393,https://openalex.org/T10211,Computational Drug Discovery Methods
W4401421666.pdf,2024-08-08,2025-08-14T05:24:48.492852,https://openalex.org/T14394,Cognitive Science and Education Research
W4401423852.pdf,2024-08-01,2025-08-14T05:25:16.392977,https://openalex.org/T10531,Advanced Vision and Imaging
W4401426530.pdf,2024-08-08,2025-08-14T05:25:18.687263,https://openalex.org/T10594,Genetic and phenotypic traits in livestock
W4401428398.pdf,2024-08-08,2025-08-14T05:25:19.410301,https://openalex.org/T13398,Data Analysis with R
W4401437416.pdf,2024-08-08,2025-08-14T05:25:20.090806,https://openalex.org/T11902,Intelligent Tutoring Systems and Adaptive Learning
W4401443444.pdf,2024-01-01,2025-08-14T05:25:20.695729,https://openalex.org/T10630,Orthopedic Surgery and Rehabilitation
W4401465717.pdf,2024-08-01,2025-08-14T05:25:21.925954,https://openalex.org/T13377,Ecosystem dynamics and resilience
W4401479535.pdf,2024-08-10,2025-08-14T05:25:25.856391,https://openalex.org/T11438,Retinal Imaging and Analysis
W4401494597.pdf,2024-08-11,2025-08-14T05:25:27.845388,https://openalex.org/T11405,Geophysics and Gravity Measurements
W4401496735.pdf,2024-08-11,2025-08-14T05:25:28.888377,https://openalex.org/T10791,Advanced Control Systems Optimization
W4401560048.pdf,2024-08-14,2025-08-14T05:25:31.660780,https://openalex.org/T10763,Digital Transformation in Industry
W4401639476.pdf,2024-08-16,2025-08-14T05:25:37.617950,https://openalex.org/T11447,Blind Source Separation Techniques
W4401661428.pdf,2024-08-08,2025-08-14T05:25:43.791694,https://openalex.org/T10531,Advanced Vision and Imaging
W4401665823.pdf,2024-08-17,2025-08-14T05:25:44.044003,https://openalex.org/T10126,Logic, programming, and type systems
W4401667091.pdf,2024-08-06,2025-08-14T05:25:45.407985,https://openalex.org/T10883,Ethics and Social Impacts of AI
W4401673310.pdf,2024-08-18,2025-08-14T05:25:48.667367,https://openalex.org/T13283,Mental Health Research Topics
W4401675281.pdf,2024-08-11,2025-08-14T05:25:50.932811,https://openalex.org/T13830,Educational Curriculum and Learning Methods
W4401719045.pdf,2024-05-27,2025-08-14T05:25:51.608934,https://openalex.org/T10772,Distributed systems and fault tolerance
W4401768540.pdf,2024-08-22,2025-08-14T05:25:58.681168,https://openalex.org/T12389,Infrared Target Detection Methodologies
W4401809415.pdf,2024-08-23,2025-08-14T05:26:03.365134,https://openalex.org/T10502,Advanced Memory and Neural Computing
W4401818710.pdf,2024-08-23,2025-08-14T05:26:03.988760,https://openalex.org/T11344,Traffic Prediction and Management Techniques
W4401840952.pdf,2024-08-24,2025-08-14T05:26:05.437348,https://openalex.org/T12111,Industrial Vision Systems and Defect Detection
W4401857078.pdf,2024-08-24,2025-08-14T05:26:06.049192,https://openalex.org/T10028,Topic Modeling
W4401857080.pdf,2024-08-24,2025-08-14T05:26:06.413826,https://openalex.org/T11273,Advanced Graph Neural Networks
W4401857088.pdf,2024-08-24,2025-08-14T05:26:07.187648,https://openalex.org/T11344,Traffic Prediction and Management Techniques
W4401857188.pdf,2024-08-24,2025-08-14T05:26:07.719522,https://openalex.org/T11273,Advanced Graph Neural Networks
W4401863472.pdf,2024-08-24,2025-08-14T05:26:10.231162,https://openalex.org/T11273,Advanced Graph Neural Networks
W4401897941.pdf,2024-08-06,2025-08-14T05:26:14.233084,https://openalex.org/T10770,Soil Geostatistics and Mapping
W4401991124.pdf,2024-01-01,2025-08-14T05:26:14.941889,https://openalex.org/T10603,Smart Grid Energy Management
W4401993048.pdf,2024-08-29,2025-08-14T05:26:16.879538,https://openalex.org/T12262,Hate Speech and Cyberbullying Detection
W4401993157.pdf,2024-08-29,2025-08-14T05:26:18.765459,https://openalex.org/T11714,Multimodal Machine Learning Applications
W4401993253.pdf,2024-08-29,2025-08-14T05:26:19.460757,https://openalex.org/T10211,Computational Drug Discovery Methods
W4402019410.pdf,2024-08-29,2025-08-14T05:26:21.887392,https://openalex.org/T11206,Model Reduction and Neural Networks
W4402022689.pdf,2024-08-29,2025-08-14T05:26:24.068684,https://openalex.org/T10730,Language Development and Disorders
W4402031287.pdf,2024-08-30,2025-08-14T05:26:24.735575,https://openalex.org/T11992,CCD and CMOS Imaging Sensors
W4402095100.pdf,2024-08-31,2025-08-14T05:26:25.482474,https://openalex.org/T11276,Solar Radiation and Photovoltaics
W4402110555.pdf,2024-08-30,2025-08-14T05:26:28.198430,https://openalex.org/T10601,Handwritten Text Recognition Techniques
W4402133816.pdf,2024-08-30,2025-08-14T05:26:29.798784,https://openalex.org/T12467,Rangeland Management and Livestock Ecology
W4402216596.pdf,2024-01-01,2025-08-14T05:26:35.200729,https://openalex.org/T10711,Target Tracking and Data Fusion in Sensor Networks
W4402225681.pdf,2024-01-01,2025-08-14T05:26:35.632764,https://openalex.org/T10928,Probabilistic and Robust Engineering Design
W4402262896.pdf,2024-09-05,2025-08-14T05:26:36.281521,https://openalex.org/T10326,Indoor and Outdoor Localization Technologies
W4402272904.pdf,2024-09-05,2025-08-14T05:26:37.703839,https://openalex.org/T11289,Single-cell and spatial transcriptomics
W4402308935.pdf,2024-09-06,2025-08-14T05:26:39.550567,https://openalex.org/T12428,Global Trade and Competitiveness
W4402670026.pdf,2024-01-01,2025-08-14T05:26:49.323483,https://openalex.org/T10201,Speech Recognition and Synthesis
W4402673417.pdf,2024-09-20,2025-08-14T05:26:50.056632,https://openalex.org/T10791,Advanced Control Systems Optimization
W4402699298.pdf,2024-09-21,2025-08-14T05:26:51.127033,https://openalex.org/T10612,Magnetism in coordination complexes
W4402812473.pdf,2024-09-24,2025-08-14T05:26:54.257727,https://openalex.org/T10403,Phonetics and Phonology Research
W4402836670.pdf,2024-01-01,2025-08-14T05:26:54.878093,https://openalex.org/T10791,Advanced Control Systems Optimization
W4402836811.pdf,2024-01-01,2025-08-14T05:26:56.731821,https://openalex.org/T10791,Advanced Control Systems Optimization
W4402903971.pdf,2024-06-17,2025-08-14T05:26:58.810094,https://openalex.org/T11714,Multimodal Machine Learning Applications
W4402916619.pdf,2024-06-17,2025-08-14T05:27:01.164452,https://openalex.org/T10689,Remote-Sensing Image Classification
W4402968902.pdf,2024-09-30,2025-08-14T05:27:01.421652,https://openalex.org/T10885,Gene expression and cancer classification
W4402979846.pdf,2024-07-15,2025-08-14T05:27:01.772744,https://openalex.org/T10331,Video Surveillance and Tracking Methods
W4402989305.pdf,2024-01-01,2025-08-14T05:27:02.691382,https://openalex.org/T11304,Advanced Neuroimaging Techniques and Applications
W4403192863.pdf,2024-10-05,2025-08-14T05:27:05.972375,https://openalex.org/T10220,Machine Fault Diagnosis Techniques
W4403284087.pdf,2024-09-13,2025-08-14T05:27:10.933727,https://openalex.org/T10715,Distributed and Parallel Computing Systems
W4403284559.pdf,2024-09-16,2025-08-14T05:27:11.619397,https://openalex.org/T11891,Big Data and Business Intelligence
W4403390867.pdf,2024-01-01,2025-08-14T05:27:14.054713,https://openalex.org/T10627,Advanced Image and Video Retrieval Techniques
W4403421267.pdf,2024-06-28,2025-08-14T05:27:14.525656,https://openalex.org/T12702,Brain Tumor Detection and Classification
W4403436349.pdf,2024-10-15,2025-08-14T05:27:17.380804,https://openalex.org/T10270,Blockchain Technology Applications and Security
W4403528331.pdf,2024-10-18,2025-08-14T05:27:18.589560,https://openalex.org/T10429,EEG and Brain-Computer Interfaces
W4403811090.pdf,2024-10-28,2025-08-14T05:27:20.066070,https://openalex.org/T11550,Text and Document Classification Technologies
W4403859682.pdf,2024-10-29,2025-08-14T05:27:21.458523,https://openalex.org/T10050,Multi-Criteria Decision Making
W4403918293.pdf,2024-10-30,2025-08-14T05:27:22.405433,https://openalex.org/T10425,Cold Atom Physics and Bose-Einstein Condensates
W4403939985.pdf,2024-10-31,2025-08-14T05:27:29.308852,https://openalex.org/T10320,Neural Networks and Applications
W4404103762.pdf,2024-11-06,2025-08-14T05:27:31.135121,https://openalex.org/T10044,Protein Structure and Dynamics
W4404188448.pdf,2024-11-08,2025-08-14T05:27:33.108324,https://openalex.org/T10002,Advanced Chemical Physics Studies
W4404238297.pdf,2024-01-01,2025-08-14T05:27:34.007300,https://openalex.org/T11398,Hand Gesture Recognition Systems
W4404248508.pdf,2024-11-10,2025-08-14T05:27:35.480860,https://openalex.org/T10705,Additive Manufacturing Materials and Processes
W4404375569.pdf,2024-11-14,2025-08-14T05:27:36.682430,https://openalex.org/T12611,Neural Networks and Reservoir Computing
W4404503554.pdf,2024-11-19,2025-08-14T05:27:37.803487,https://openalex.org/T10429,EEG and Brain-Computer Interfaces
W4404641055.pdf,2024-11-23,2025-08-14T05:27:38.954634,https://openalex.org/T11095,Emergency and Acute Care Studies
W4404682712.pdf,2024-11-26,2025-08-14T05:27:42.271575,https://openalex.org/T11052,Energy Load and Power Forecasting
W4404704768.pdf,2024-11-01,2025-08-14T05:27:43.382192,https://openalex.org/T10372,Cardiac Imaging and Diagnostics
W4404903187.pdf,2024-12-02,2025-08-14T05:27:44.184802,https://openalex.org/T10235,Health disparities and outcomes
W4404916036.pdf,2024-07-30,2025-08-14T05:27:45.298585,https://openalex.org/T10502,Advanced Memory and Neural Computing
W4404924985.pdf,2024-08-02,2025-08-14T05:27:45.671191,https://openalex.org/T10203,Recommender Systems and Techniques
W4404956628.pdf,2024-12-04,2025-08-14T05:27:47.525043,https://openalex.org/T11636,Artificial Intelligence in Healthcare and Education
W4404965953.pdf,2024-12-03,2025-08-14T05:27:50.282717,https://openalex.org/T10775,Generative Adversarial Networks and Image Synthesis
W4404978949.pdf,2024-12-01,2025-08-14T05:27:50.850827,https://openalex.org/T10400,Network Security and Intrusion Detection
W4404985095.pdf,2024-12-03,2025-08-14T05:27:56.367287,https://openalex.org/T10775,Generative Adversarial Networks and Image Synthesis
W4404993603.pdf,2024-12-04,2025-08-14T05:27:57.032465,https://openalex.org/T10429,EEG and Brain-Computer Interfaces
W4405181420.pdf,2024-12-02,2025-08-14T05:27:59.276661,https://openalex.org/T11689,Adversarial Robustness in Machine Learning
W4405318319.pdf,2024-12-12,2025-08-14T05:28:00.992315,https://openalex.org/T11829,Mathematical Biology Tumor Growth
W4405319408.pdf,2024-12-12,2025-08-14T05:28:02.618932,https://openalex.org/T11261,Quantum chaos and dynamical systems
W4405447707.pdf,2024-12-14,2025-08-14T05:28:06.428074,https://openalex.org/T10586,Robotic Path Planning Algorithms
W4405717824.pdf,2024-01-01,2025-08-14T05:28:11.404810,https://openalex.org/T10331,Video Surveillance and Tracking Methods
W4405718500.pdf,2024-01-01,2025-08-14T05:28:11.760369,https://openalex.org/T12131,Wireless Signal Modulation Classification
W1816167564.pdf,2023-11-08,2025-08-14T05:28:13.281933,https://openalex.org/T10025,Black Holes and Theoretical Physics
W2801153231.pdf,2023-01-24,2025-08-14T05:28:17.991674,https://openalex.org/T10659,Marine animal studies overview
W2904848392.pdf,2023-12-18,2025-08-14T05:28:18.256209,https://openalex.org/T10987,Microfinance and Financial Inclusion
W2928495730.pdf,2023-01-05,2025-08-14T05:28:19.091241,https://openalex.org/T10061,Algebraic Geometry and Number Theory
W2950869740.pdf,2023-07-20,2025-08-14T05:28:19.809344,https://openalex.org/T11692,Noise Effects and Management
W2962716880.pdf,2023-05-22,2025-08-14T05:28:20.540483,https://openalex.org/T10260,Software Engineering Research
W2963771724.pdf,2023-05-31,2025-08-14T05:28:24.394129,https://openalex.org/T11689,Adversarial Robustness in Machine Learning
W2967121770.pdf,2023-04-19,2025-08-14T05:28:24.929111,https://openalex.org/T10928,Probabilistic and Robust Engineering Design
W2971191785.pdf,2023-07-20,2025-08-14T05:28:25.237830,https://openalex.org/T10820,Fuzzy Logic and Control Systems
W2974826809.pdf,2023-05-26,2025-08-14T05:28:26.054160,https://openalex.org/T10061,Algebraic Geometry and Number Theory
W2975585348.pdf,2023-09-26,2025-08-14T05:28:27.298729,https://openalex.org/T11680,Advanced Algebra and Geometry
W2990797249.pdf,2023-01-19,2025-08-14T05:28:27.946043,https://openalex.org/T11680,Advanced Algebra and Geometry
W2994903311.pdf,2023-04-03,2025-08-14T05:28:28.481364,https://openalex.org/T10791,Advanced Control Systems Optimization
W3002343169.pdf,2023-04-19,2025-08-14T05:28:28.932935,https://openalex.org/T12351,Geometry and complex manifolds
W3007487205.pdf,2023-07-20,2025-08-14T05:28:29.462789,https://openalex.org/T10234,Obstructive Sleep Apnea Research
W3034125782.pdf,2023-07-20,2025-08-14T05:28:30.097316,https://openalex.org/T10220,Machine Fault Diagnosis Techniques
W3041503331.pdf,2023-02-09,2025-08-14T05:28:30.863142,https://openalex.org/T10320,Neural Networks and Applications
W3088899192.pdf,2023-05-23,2025-08-14T05:28:35.357284,https://openalex.org/T11692,Noise Effects and Management
W3092698439.pdf,2023-03-07,2025-08-14T05:28:36.115865,https://openalex.org/T10064,Complex Network Analysis Techniques
W3096758594.pdf,2023-03-23,2025-08-14T05:28:36.978681,https://openalex.org/T12970,Names, Identity, and Discrimination Research
W3109028199.pdf,2023-07-24,2025-08-14T05:28:38.210047,https://openalex.org/T10028,Topic Modeling
W3109276310.pdf,2023-05-01,2025-08-14T05:28:38.503324,https://openalex.org/T11830,Point processes and geometric inequalities
W3112341889.pdf,2023-05-03,2025-08-14T05:28:40.500206,https://openalex.org/T10775,Generative Adversarial Networks and Image Synthesis
W3116783416.pdf,2023-03-22,2025-08-14T05:28:41.984217,https://openalex.org/T11303,Bayesian Modeling and Causal Inference
W3124307736.pdf,2023-10-31,2025-08-14T05:28:43.614905,https://openalex.org/T10845,Advanced Causal Inference Techniques
W3126428072.pdf,2023-08-07,2025-08-14T05:28:43.845086,https://openalex.org/T10500,Sparse and Compressive Sensing Techniques
W3128602097.pdf,2023-10-12,2025-08-14T05:28:45.975837,https://openalex.org/T10991,Game Theory and Voting Systems
W3128626271.pdf,2023-08-15,2025-08-14T05:28:47.291647,https://openalex.org/T13542,Grit, Self-Efficacy, and Motivation
W3151932482.pdf,2023-12-05,2025-08-14T05:28:48.138504,https://openalex.org/T10682,Quantum Computing Algorithms and Architecture
W3152780886.pdf,2023-01-22,2025-08-14T05:28:49.976374,https://openalex.org/T10500,Sparse and Compressive Sensing Techniques
W3153697283.pdf,2023-12-05,2025-08-14T05:28:50.781855,https://openalex.org/T11325,Inertial Sensor and Navigation
W3154996842.pdf,2023-04-07,2025-08-14T05:28:51.108573,https://openalex.org/T13718,Media Influence and Politics
W3155266040.pdf,2023-01-09,2025-08-14T05:28:52.250527,https://openalex.org/T10876,Fault Detection and Control Systems
W3156701796.pdf,2023-01-03,2025-08-14T05:28:53.298720,https://openalex.org/T10020,Quantum Information and Cryptography
W3160050484.pdf,2023-10-16,2025-08-14T05:28:53.863942,https://openalex.org/T10538,Data Mining Algorithms and Applications
W3163779489.pdf,2023-06-01,2025-08-14T05:28:54.130427,https://openalex.org/T11273,Advanced Graph Neural Networks
W3165756999.pdf,2023-04-27,2025-08-14T05:28:54.952768,https://openalex.org/T12784,Modular Robots and Swarm Intelligence
W3166343970.pdf,2023-07-20,2025-08-14T05:28:56.005004,https://openalex.org/T11692,Noise Effects and Management
W3166791263.pdf,2023-02-10,2025-08-14T05:28:57.739643,https://openalex.org/T11901,Bayesian Methods and Mixture Models
W3167377032.pdf,2023-01-01,2025-08-14T05:28:58.267658,https://openalex.org/T10931,Direction-of-Arrival Estimation Techniques
W3172044612.pdf,2023-09-12,2025-08-14T05:28:59.160692,https://openalex.org/T10657,Topological Materials and Phenomena
W3177724741.pdf,2023-01-01,2025-08-14T05:29:09.217539,https://openalex.org/T11689,Adversarial Robustness in Machine Learning
W3184856583.pdf,2023-11-11,2025-08-14T05:29:11.014906,,
W3187182912.pdf,2023-05-02,2025-08-14T05:29:12.192709,https://openalex.org/T12814,Gaussian Processes and Bayesian Inference
W3187239303.pdf,2023-12-06,2025-08-14T05:29:12.979843,https://openalex.org/T11010,Logic, Reasoning, and Knowledge
W3193217860.pdf,2023-01-01,2025-08-14T05:29:15.815334,https://openalex.org/T11233,Advanced Adaptive Filtering Techniques
W3193430349.pdf,2023-01-01,2025-08-14T05:29:19.485443,https://openalex.org/T11019,Image Enhancement Techniques
W3194468394.pdf,2023-04-28,2025-08-14T05:29:20.030366,https://openalex.org/T11829,Mathematical Biology Tumor Growth
W3194680709.pdf,2023-11-01,2025-08-14T05:29:21.119079,https://openalex.org/T10591,Theoretical and Computational Physics
W3195180572.pdf,2023-01-01,2025-08-14T05:29:21.423270,https://openalex.org/T10036,Advanced Neural Network Applications
W3196212238.pdf,2023-02-28,2025-08-14T05:29:21.691065,https://openalex.org/T10711,Target Tracking and Data Fusion in Sensor Networks
W3199006461.pdf,2023-06-12,2025-08-14T05:29:23.328914,https://openalex.org/T10682,Quantum Computing Algorithms and Architecture
W3199258799.pdf,2023-07-20,2025-08-14T05:29:23.914905,https://openalex.org/T13261,Elasticity and Wave Propagation
W3199985473.pdf,2023-09-05,2025-08-14T05:29:24.419530,https://openalex.org/T10305,Power System Optimization and Stability
W3202061712.pdf,2023-01-03,2025-08-14T05:29:27.341721,https://openalex.org/T11605,Visual Attention and Saliency Detection
W3202670445.pdf,2023-06-01,2025-08-14T05:29:29.442203,https://openalex.org/T11714,Multimodal Machine Learning Applications
W3203241353.pdf,2023-07-20,2025-08-14T05:29:29.728668,https://openalex.org/T10791,Advanced Control Systems Optimization
W3205171733.pdf,2023-04-28,2025-08-14T05:29:30.599672,https://openalex.org/T12026,Explainable Artificial Intelligence (XAI)
W3205532394.pdf,2023-06-28,2025-08-14T05:29:30.875660,https://openalex.org/T10036,Advanced Neural Network Applications
W3207851878.pdf,2023-07-04,2025-08-14T05:29:31.771135,https://openalex.org/T11206,Model Reduction and Neural Networks
W3209079568.pdf,2023-01-01,2025-08-14T05:29:34.149142,https://openalex.org/T11206,Model Reduction and Neural Networks
W3209085018.pdf,2023-01-03,2025-08-14T05:29:35.050986,https://openalex.org/T10579,Cognitive Radio Networks and Spectrum Sensing
W3209492300.pdf,2023-01-01,2025-08-14T05:29:36.125560,https://openalex.org/T11689,Adversarial Robustness in Machine Learning
W3210577245.pdf,2023-06-13,2025-08-14T05:29:36.503829,https://openalex.org/T10928,Probabilistic and Robust Engineering Design
W3211100149.pdf,2023-01-01,2025-08-14T05:29:37.325696,https://openalex.org/T11368,Long-Term Effects of COVID-19
W3214844992.pdf,2023-01-17,2025-08-14T05:29:38.102629,https://openalex.org/T11428,Advanced Mathematical Identities
W3215292571.pdf,2023-05-16,2025-08-14T05:29:52.447396,https://openalex.org/T10029,Climate variability and models
W3215595862.pdf,2023-01-12,2025-08-14T05:29:52.847859,https://openalex.org/T14509,demographic modeling and climate adaptation
W3215807011.pdf,2023-06-01,2025-08-14T05:29:54.185688,https://openalex.org/T10719,3D Shape Modeling and Analysis
W3217085173.pdf,2023-02-01,2025-08-14T05:29:54.782383,https://openalex.org/T10067,Stochastic processes and financial applications
W3217488890.pdf,2023-02-17,2025-08-14T05:29:55.254491,https://openalex.org/T11513,stochastic dynamics and bifurcation
W3217598197.pdf,2023-01-01,2025-08-14T05:29:57.193313,https://openalex.org/T11206,Model Reduction and Neural Networks
W4221161868.pdf,2023-01-31,2025-08-14T05:29:59.668637,https://openalex.org/T10048,Particle physics theoretical and experimental studies
W4223438685.pdf,2023-01-30,2025-08-14T05:30:00.565435,https://openalex.org/T10917,Smart Grid Security and Resilience
W4225298576.pdf,2023-05-09,2025-08-14T05:30:01.356471,https://openalex.org/T10067,Stochastic processes and financial applications
W4226449833.pdf,2023-01-25,2025-08-14T05:30:02.384005,https://openalex.org/T11707,Gaze Tracking and Assistive Technology
W4280498166.pdf,2023-01-01,2025-08-14T05:30:03.307811,https://openalex.org/T11309,Music and Audio Processing
W4280561461.pdf,2023-07-07,2025-08-14T05:30:03.843570,https://openalex.org/T10046,Stability and Control of Uncertain Systems
W4281737364.pdf,2023-01-01,2025-08-14T05:30:06.731525,https://openalex.org/T10064,Complex Network Analysis Techniques
W4282945631.pdf,2023-01-01,2025-08-14T05:30:07.206640,https://openalex.org/T10028,Topic Modeling
W4285827756.pdf,2023-04-14,2025-08-14T05:30:09.000396,https://openalex.org/T10588,Mathematical Dynamics and Fractals
